date,url,job_title,company_name,location,old,salary,job_details
09/08/2022,https://www.glassdoor.co.uk/partner/jobListing.htm?pos=517&ao=1110586&s=58&guid=000001828254d9398beba8f94a9a973f&src=GD_JOB_AD&t=SR&vt=w&cs=1_db83c1e5&cb=1660043975399&jobListingId=1008050111410&cpc=0FE1F5EA2BC84A01&jrtk=3-0-1ga159mcqgahv801-1ga159md9g4e6800-203b802b2920ed7e--6NYlbfkN0DG4ntHtB_rMsnfhgmnSvK2brktLme1L4SiDeJjQ-izrVOLqRJ5-yjEhSyAj73O13TRz82Yll7itr0KZrBXYHfdp2Ra3DcXSQ76WIIKHT_kDzrjffgBVtCXG-IL10LY26a50n6coo9M_9WItleIbGSccaR2GWTSEnmNiknX8zB9xZrtbC-7kbo04GV75l9gHMT6grx4z_a61TfgQGp0pGExHQUBvq-jZJ5-mhwv-s2ma9vCu0JhaqtWwZ0DaTi9Mfgbhd7sfrbbaSSCf6evg07zj8ADcAeHzT1A21U14Ib9awjJ6Ni4dE8LkZTKyU6nmp7SSP2__VDpsg-WnzTu2AWczzIXkRx4wLP69s1K6GUDP4OP2WlQxcfOsxhXluIG9eMOOiiBZEBC0d9dJ1Sgar7f9okDNaFKuhmuyC6NMMim4mD4GaUWA8t7eHoMWizc1z2AkjQ-QTXOzSTF8zgyIrx3EhbWkmbwXR242OmmHVy4syw4N30gMJWTTiGs2Xf9y_tDC29O0QUewq8fHWZWstLXVSoSsGzCYg6C_FXXG65j3U9OO1o94Z7aNmhpH_nHkWyInm8pWpKVLCfgPxfs4uql154zjtqKo9ydrU6j4PtL_5avDbbseBxXtiPDnRYMA-RL6jUAkYR20Wr1TWxz3kYg6qdo_6N7MdD9W2-v6yCPLn7P1rehfCT64URrgvLd-yAFXQY_isWElCA4o-2VdjgBHCeP0qsmysXiLZY0wp6-fdLYY1-b0T9NWk5Yz4egRDpHEJx2HMDHlPpRfm6Z9UkYeDOr58NrshrKN5Z6-Wg45Pm0XriS-2fzLtBMiYTpsAXnXi-_4SeztESLSJ5u-n0PViiPBByVzk2orzXclC1LNsOxup9pGiwqd24AbCdjUjbrLipi1wc1tqzUVgZ2xKqzNX7mkikcEvPhBM7CzOtcgrcfLHgfRdvfAqaCDMk9ByvEF5mUrXe6nQHVKxo1yNXMgVxolKUYnR1shGJi7qlJ7g%3D%3D,Senior Backend Engineer (Node.js),Emma,"London, England",5d,£60K - £120K  (Employer Est.),"Emma is the app to manage all things money. Our mission is to empower millions of people to live a better and more fulfilling financial life. 
Emma was founded by engineers, who are extremely focused on coding, product and data. These are the three pillars on which we want to build a strong tech culture and fix personal finance once for all.
 We have raised more than $8m+ to date to build the one stop shop for all your financial life. Our investors include Connect Ventures (investor in Curve, TrueLayer and CityMapper), Kima Ventures, one of the first in Transferwise, and Aglaé Ventures, early stage fund of the Groupe Arnault, investor in Netflix and Airbnb. Alongside them, several angel investors, who have built and sold industry leading companies have decided to take part into this journey.
 At Emma, we are: 
Bold 
Determined 
Focused 
Autonomous
 
 Responsibilities: 
Your focus will be on our mobile app! We have an intense roadmap ahead, which includes a plethora of new features and integrations, which you will be part of. Our tech stack: 
Google Cloud 
Vitess - MySQL 
CockroachDB 
NodeJS (TypeScript) 
Kubernetes 
Docker 
Redis 
React Native (TypeScript) 
Redux
 
 Some of our current interests lie in: 
 Product:  We are building the 1st Finance App in the UK, used by thousands of people every day. We are shipping an average of a feature per week. 
 Machine learning:  We have an enormous amount of transaction data, which we are using to provide better insights to our users. Predicting when a user is going in overdraft, when a card payment is coming through or clustering a huge set of subscriptions are a few of the problems we are tackling. 
Scaling:  We need to keep Emma up and running. This means an intense effort and quality in the work we do. ️  Speed:  In this industry what really matters is speed. If we had to compare ourselves to someone, we like to think we would be Bolt.
 
About you: 
 
You are a JavaScript developer with at least 5 years’ experience 
You are fast and love to deliver incredible code 
You can reduce complex problems to simple solutions 
You want to be part of an amazing team 
You are excited by what we're building at Emma 
Phone call with a member of the team 
Take-home test 
Phone call with CTO and another senior engineer 
May the gummy bear power be with you! 
Node.js, TypescriptNode.js, Typescript, MySQL, Kubernetes, Docker, Redis, GCP"
09/08/2022,https://www.glassdoor.co.uk/partner/jobListing.htm?pos=518&ao=1110586&s=58&guid=000001828254d9398beba8f94a9a973f&src=GD_JOB_AD&t=SR&vt=w&cs=1_75ad686c&cb=1660043975400&jobListingId=1008048418326&cpc=0C139D4CAD5A6DB2&jrtk=3-0-1ga159mcqgahv801-1ga159md9g4e6800-2317c33957f593ff--6NYlbfkN0DG4ntHtB_rMsnfhgmnSvK2brktLme1L4SiDeJjQ-izrVOLqRJ5-yjEhSyAj73O13ROpSzp79vSWscbHJz5qEZeleIk-aYuEUd6xTG7yJJJi4XkTgrVmKKtnTyVH_m-tU5UvWZmDihLNBRrbdXaPUQOW_NdsC49yvOFBkqRUWQZEYsfaU32BdAQ9TTE3W6IM_dOdeTetKwPYSp1uj_csCr3aagbAGAhUc_Hwq5CKpXpCkl-aq-UHu_WYE0hZ0-HXkqAh0pNPkwAHA8k7uyexJhYmw5ov-du9fV_BaGsKQfgdFf_nubjgEEOhYBG7taq541F7oxHVxhIWw9mb4pCovX1-Y1MNrIENLolmg2OER81sm6DwynvjjGJJcda4LyS0ExgLYdihvJwEb74hf84r6okxoEDLt2OcPK6c6jd5Q6eG_jgYQgd0QisJlB1IsCUoEMKp8uvOPkM7Ohj-GUy49xeTNvZYpLZ0xCXmPUujtdJez2bS69oD6XITJ3V9eLCuzJbGs-yPao70-cHQq9WhiVkKo1shoHEaN5XKa_D55zCZEnIKwfrY1TJnhkS4d-0jW_5lNuiLIT26rpbitGd78B7i3L4JVXvDX50LjkZFVbc7OHsv_xTtk0b61-ob9IyzFLCWb5AFMwKWbqUGGjlpnoq8dFWMY3wwC3DmsKxxMOGjmjSksNVS8DcOLKdKUqhOsejA-HLNuUsOyzrl8FerDfY5iEcYRaVe2klbAxE0SiBiRMkaPmQj9kOi2zLC8tRyhKEzDdevuSDnk61Jg4EO0q_kMlHyFtDhBn0LJJZXpCIQBakuWElYa-EagPWE6GnTxx2R4RTmoGky35s91rocnVqh7i_qnyFIwbWXkAT7k8rNDUtkijiJMfnu8TUtN1yni9FZPl701SQG1KbI5m1N1msrL2jbOOUv6LyXmqH5cYWmzKCPF5hb0mci5_SJoTnPU00rQTVd244Uq4bf80zcBe4,Full Stack Developer,Fnatic,"London, England",6d,,"As part of the Tech team at Fnatic, your days will be filled developing engaging experiences and products across our fast-moving business.
 You’ll have an eye for the fine details and the solutions you develop are the most elegant. You'll get to work on projects from memberships to community features, personalisation across apps and much more! 
You get excited by new techniques, problem solving regardless of the domain, and love the idea of developing highly functional, data-rich complex-systems. Most of all, you're excited to join a small team where your impact is highly measurable and helps amplify a brand loved globally by millions of fans! 
 
Our Stack: 
React, Next.js, Tailwind CSS 
Sanity CMS, Shopify, FusionAuth
 Vercel, Cloudflare & AWS 
Python, Node
 
 Your mission is to: 
Work within an agile team on a range of projects across our Product function 
Contribute technical ideas and workflow improvements to enhance the direction of Fnatic 
Work with complex ecommerce systems and community focused products such as accounts and personalisation within the video game space! 
Launch creative digital campaigns 
Review analytics and performance metrics to draw conclusions and drive change
 
 We're looking for: 
 
Commercial development experience, building and integrating functional components from design spec to production (2-5 years is likely to be suitable) 
A compelling portfolio or deep-dives of previous projects on GitHub etc. 
Proficiency with JavaScript and libraries like React and Next 
Experience working with backend languages 
Experience integrating and building APIs 
Working knowledge of databases both relational and non-relational 
Performance optimisation skills e.g. Workers, Background Tasks, Critical Rendering Path, etc. 
Basic on-page SEO knowledge with supporting semantic HTML, Link structures, etc. 
Working knowledge of headless CMS and/or Shopify is a bonus! 
A quick learner, with an entrepreneurial drive and team-centric mentality 
Excellent verbal and written communication in English 
Desire to get stuck in and explore evolving technologies 
Amazing debugging skills! 
Macbook 
Hybrid distributed/onsite working 
Bonus Scheme 
Private medical insurance 
Fnatic shop discount 
Cycle to Work Scheme 
Eyecare vouchers 
Take What You Need leave policy 
Fruit, drinks and snacks daily 
Recruiter Screen - 30 min 
Role Fit interview - 45 min 
Task - 2/3 days 
Team Fit Interview - 45 min 
Option: CEO Interview 
React, Typescript, Product Design, Node.js, PythonReact, Next, Tailwind CSS, Node.js, Python, AWS"
09/08/2022,https://www.glassdoor.co.uk/partner/jobListing.htm?pos=519&ao=1110586&s=58&guid=000001828254d9398beba8f94a9a973f&src=GD_JOB_AD&t=SR&vt=w&cs=1_47bd2cf1&cb=1660043975400&jobListingId=1008048418556&cpc=5EFBB0462F9C6B7A&jrtk=3-0-1ga159mcqgahv801-1ga159md9g4e6800-6fbfa0bd9d88bb14--6NYlbfkN0DG4ntHtB_rMsnfhgmnSvK2brktLme1L4SiDeJjQ-izrVOLqRJ5-yjEhSyAj73O13ROpSzp79vSWj89sg1TNauPtrLSGTG6PYgchceJMEg34qfzzBziCPODiE4sCMLpeggwXnd8SByGeOvRoJ8oWk1fKs5K8KJsnkz0Lw2BvqntfL-G7PY9S1_yTFtOxupdgHGZF82UFSF7ZbaRgfS1tEr44WuUrwuemLZxmmKAvz4mMFyafkckuZUJRZffBwFhT0MX3OS5SSKsJBl4tR9UQ6Bhf8royWdZ8ujvMoKIna-pogKdxB63wjuTUqzqnsAPk0wL5M4Ux6xcq99uoJRDu5O-Q5QzQnUTd4Hlaad2Yx4BrnCMtrcgkAU5xOe3CLI84MSwT5Ai-X6X5Bt5SlzQitmVvbDPikJXrGsTqngIXOQHbPYp95FgDYogZUmzp-OOAUQxzLZzAt20odkR0C4rIXaW4BGkkFKeWlmFgSg5O8fk2ktvB3SDrIC189cFn-X7Hv6hWAI24wSA6Waq1cYREcmZ6XFHpgV2Ts2N-v4XDzwcp6EFBdOCyMf5y3Ucd382gc_OriE_T9O3IiaLIAhwrlFU2IudnmPIuWn3IYXddve9NHzEthv8uMpFe5cf8qWg5zBO-H0tOP1JNmzdn1cO3GDVCr-Zk_bWvp9h7z12j9RuRbQ8KafFEOCnL8CfOeXj4a4qfsSqdnpSyZbpDCyitwoAgJ89TnsFPw0fc-Rlm81clPnWrrrSQ6NAo7Y6EJy2pC4VcQaVogaqgZ5rmMfbx3syrZ6MHLeeqnIYcaQ-wa6W5xp4g8Cm8VPenrxTTJz30M0k1B17TxBIUaDwtzEmojjP1R1y1DIQ8-ltkX2PvIi3QE1m54VFKrDJpA7lPO1YFosYYUCtf5PzHUWfjG_nMz9BAC7kW6Yh9hbVtoU94E4orYnYfiaQIatb5QCPtou2OrI6Z_nr8-7SH4hCXAaIQ9welPf-Pyn6Q0ROlvceYT1EfQ%3D%3D,Senior Full Stack Developer,RPA Supervisor,"London, England",6d,£55K - £70K  (Employer Est.),"We're the leading automation management platform on the market. We help enterprises around the world solve their scaling challenges – and drive true hyperautomation. 
With experience from implementing and operating hundreds of RPA Centres of Excellence (CoEs), our primary goal is help customers achieve a stable, responsive, and efficient digital workforce. As a result, RPA Supervisor’s award-winning solution has helped CoEs worldwide successfully build the case for scaling their digital workforce. 
We are, of course, proud to deliver the best RPA management solution on the market. However, we are not done. We are problem-solvers at heart and continually add new features to our management solutions, following each customer venture. This stabilizes existing RPA while making sure our customers get the best business value possible from their digital workforce.
 About the role: 
The RPA Supervisor team is growing rapidly. As a result, we are looking for a Senior Full Stack Developer to join our RPA Supervisor product development team. 
You’ll be tasked to lead and contribute to the following types of projects: 
Implementation of new product features in both back-end and front-end 
Create new and improve on existing algorithms, like our RPA orchestration algorithms 
Full responsibility over code quality, performance and design choices 
Participate in code and design reviews, teach and learn from other engineers 
Help on train and mentor junior developers 
Be comfortable in helping to demonstrate our product to internal and external audiences 
Be a lead-advocate for engineering quality - leading adherence to definition of done, and ensuring the number of stories coming back from QA are minimised
 
 Who we’re looking for: 
The right candidate must be able to demonstrate that they are: 
A proven self-starter, with a results-driven mindset 
Well-organized 
A real team-player 
Getting-things-done 
Decent communicators 
The right person will be instrumental in helping expand and improve our web-based RPA (Robotic Process Automation) orchestration and reporting platform. Our product is unique and sophisticated in how it integrates and controls RPA software and as such, offers challenging and rewarding projects not ordinarily found in web-app development. 
We pride ourselves on being true problem solvers for our customers, so it’s very important to listen and innovate solutions based on customer-feedback and strategic priorities. If you are a problem solver by nature and a well-trained developer that wants to make a difference in working with critical business systems—this role you may be right for you! 
 
About you: 
You have a curious mind that wants to learn about our customers and how we can provide value to them through our product 
You have attention to detail and quality, but in an efficient and non-obsessive way 
You are comfortable with getting into existing code bases 
You are able to work independently when needed, and alongside teammates on projects, often at the same time 
You are fluent in spoken and written English 
You are a team player, and problem-solver
 
 Required and desired skills: 
Robust .NET Core Web applications development skill and excellent understanding of MSSQL 
Windows Services in .Net Core development experience is an asset but not a requirement 
Long experience with vanilla JavaScript, but may impress us further if you also know React 
Familiar with DevOps concepts and technologies such as CI/CD, configuration management, virtual machines or containers and cloud hosting services such as Azure, etc. 
Software engineering best practices knowledge (e.g. unit testing, code reviews, design documentation, SCRUM, Kanban)
 
 Tech stack overview: 
Our backend is in .net 5 (soon moving to .net 6), hosting a REST API and SignalR hubs to communicate with the JavaScript frontend and the RPA vendor adapters 
The RPA Vendor adapters are Windows services (also .net 5) 
We also have a product portal with a .net 5 backend and a REACT based frontend 
Share options 
Flexible working 
Generous pension plan (7% employer contribution) 
Health benefits 
Generous holiday allowance (33 days) 
Cyclescheme 
Home office budget 
Company mobile phone 
Video call 
Test 
Offer 
.NET, SQL, JavaScript, React.NET, SQL, JavaScript, React, Windows, CI/CD, Azure, Unit Testing, Scrum"
09/08/2022,https://www.glassdoor.co.uk/partner/jobListing.htm?pos=520&ao=1110586&s=58&guid=000001828254d9398beba8f94a9a973f&src=GD_JOB_AD&t=SR&vt=w&cs=1_7f33dcfc&cb=1660043975400&jobListingId=1008048418675&cpc=3DB599BF2F4828F0&jrtk=3-0-1ga159mcqgahv801-1ga159md9g4e6800-1d42e007f27fa734--6NYlbfkN0DG4ntHtB_rMsnfhgmnSvK2brktLme1L4SiDeJjQ-izrVOLqRJ5-yjEhSyAj73O13ROpSzp79vSWgq0Y6270jtq-Gm64aLVe0blgpVyjt3Zt1HDi3cCK_ISlLEAhDUJBeGYuvpUA6JdkRanwLiMlJ_uUfZOHGJYBGgNtwIi5lzeIHMnur7BshVH9xYgQsQXI09_jPkkAmavDY4rlMSTk3WyW19kN7wltXvR1BYqBXYiL3gaFIFk7EtlsuvwbIbsobk40NaIVN0FlIhTrNXiWsnHnT3hVV2K-Njy78gONjOmhKqSjKGPcoU3qBntTjmbvd6UL_pGZRDL-UoulBp13hhXiPFcEe133yZMRZkSmM9t98jF66iTh_MZ6huB29Q5Yxfnr28dPyv05nq2ByLzkgTfZ8qolp3uStIE2G-71lJavTWjVbG1ZDVND6ej0j5OTyJMrGfGF_fLjBwuwMEfAW9_rOwbUIfEdmEfpaIpJeO99AU7mqWAp1ov7apo3BkMtypjO4uUCJmmf7GnMmTO4t71bgQAMvCdwf_CVbSiwia-RvUpjPqfcSyG4S27K4L8p1ojZMI9rfHM52AtVoUkw0d6y6zvgQ_8H50dwj20ekPTEPGWcvGNi9YGZYBRa6kg2iMeFtrBPchad_3TtxmI2IqDI4-InQHc60Y_pZJVBSnp9VBzl7wjSg2Yq3oU29hLTmcCbKrTRoBLx6o8kAVT62T5PUUyfzzi8ousYXiVzUOhupcAMNwhbY9f5eoorO58ni2FTJB-w5RKZpxDxb30t1ts9W-ETZSniejPRGfMPYEcnLWeA40ndKp3Yjnitj4AABRn0EdrdloqV--QghFzIAwtmZQXqgzRq9gsuJXRlZSLzNMdQFzH9bk-ZAj07_fNVxRX78Ojqkr4CTxuaalZKdWbBf5-PDROU2oHmpQ-NHbQ2Xsd3IJHiXfyQrkVVwPM3fu0PFo1diTv_OMFi-zAS0wksW1apZqMIOHGAcMrpyXZ4H2QC8ffe0hQHbFFioxoQFIvsxEXMtDPsbD2ulLOyLMK,Full Stack Developer (Product Engineer / Developer),Florence,"London, England",6d,£45K - £90K  (Employer Est.),"What does Florence do? 
Florence is building the technology to power the health and social care workforce. From first revenue in 2017, we have grown to a team of 100+ people across the UK. Our goal is to become a category defining tech company that empowers the entire health and social care workforce across the UK and internationally. 
Engineering culture 
We have real input into the product’s development and work closely with people from around the business to offer suggestions and ideas 
We tend to keep projects small. We favour rapid iteration and learning over big releases 
We’re happy to throw out a solution if it does not help our customers 
We’re open to ideas from across the business and regularly update our roadmaps to prioritise the most pressing needs 
We encourage software engineers to embrace data and to care about the success of the product 
We encourage learning and development. You get a budget to spend on books and courses and we have a learning day on the last Friday of every month 
Our tech stack 
Infrastructure: Heroku 
Backend: Ruby on Rails / Postgres / redis 
Frontend: React 
Mobile apps: Flutter 
What you’ll be doing 
You’ll work with the rest of the Product team and a range of stakeholders to develop and improve one or more of the following products: 
Florence Flex : our core product at Florence, is a marketplace that connects care providers with nurses and care workers looking for flexible shifts. This product has an annual turnover of £80m and is used by more than 2,000 care providers across the UK. Nurses and carers have worked over 2 million hours and earned more than £25 million by booking shifts through Florence Flex. 
Florence Rota:  is our shift management SaaS product for care homes to manage their own staff internally. Care providers use this to save time and to ensure that they always have the staff they need to provide care for their residents. 
Florence Academy : provides online training for nurses and carers. People from around the world use this product to develop the skills needed to provide the best possible care for those who need it. Care providers use this to provide training for their in-house care staff. 
Who are we? 
We’re a team of Software Engineers, Product designers and Product managers with a variety of backgrounds, skills and experiences. Our most recent Product manager was promoted from our customer success team and we have team members who’ve graduated from bootcamps such as General Assembly. You can learn more about some of the people who work here on our blog. 
Benefits 
25 days holiday (pro rata) + 8 Bank holidays and holiday roll over / buy more holiday scheme 
Cycle to work scheme 
Learning budget with Learnerbly 
Private Healthcare 
Employee Assistance Programme in place 
Opportunity to contribute to growth in an early stage startup 
Fun, friendly and collaborative startup office environment 
Regular company and social outings 
Quarterly hackathons 
Monthly Friday learning day 
Equal opportunities at Florence 
We promote an environment for our staff and app users that welcomes people from all backgrounds, ethnicities, races, religions, genders, sexual identities, abilities, and personal circumstances, in a spirit of inclusivity and belonging. 
We are proud to be an equal opportunities employer, and believe we find our strength in our diversity. If you require any accommodation to assist you in the interview process, please submit this with your enquiry. 
We offer competitive salaries within a flexible, empathetic and highly collaborative working environment. If you are motivated by the prospect of a career with a forward-thinking tech company committed to inclusion, we’d love to hear from you. 
Our interview process is simple, just two rounds and no coding tests. 
The first round is a chat with our CTO and a software engineer - there will be some “tell us about a time when…” questions around your experience building web applications and plenty of opportunities for you to find out more about Florence. 
The second round is a chat with one of our product managers and someone else from the team. This is more informal and gives you an opportunity to meet more of the team. We'll talk through one of the product challenges we're tackling at the moment and get some of your thoughts and ideas. 
For more junior candidates (<1 year experience) we may in addition ask you to undertake a brief code review of some sample code, highlighting what it does, and any areas you would improve it. 
Ruby on Rails, React, FlutterRuby on Rails, React, Flutter, Heroku"
09/08/2022,https://www.glassdoor.co.uk/partner/jobListing.htm?pos=521&ao=1110586&s=58&guid=000001828254d9398beba8f94a9a973f&src=GD_JOB_AD&t=SR&vt=w&cs=1_64f3091e&cb=1660043975400&jobListingId=1007869640493&cpc=42BEC95245890617&jrtk=3-0-1ga159mcqgahv801-1ga159md9g4e6800-cf9cdf8ac5115ef9--6NYlbfkN0B4I0z8Vg4C22bXJk453pUE2nnLCUOyY_R-ihB16RDW6wYQUKHhB-cMKfVt-iSg2CsEaKiMYy0Gp0Pzy_3LBrDoL2YRBHr5LJDRuxicnBmP5SE4fGJHHCRQO2OZxVQGSHbDmGX6pHqitFRYHnFvxi7ns6-_3fhcfqIDp9ImQXjih9eqJ5d9KAHmpxoy_-ue5SqT1JHsNf1n-CUiB9HCZErPds9YxXXGklQ_upQ_s_Dc5S2lJ0lpiOqJE9j-IeRvMzxxr2k0DiACw-dmE2-l3DGOwkx0P9dWCmuuGfCp7ZmTvutHjCHu9YkIMQvkz07QAexRjNOsM7heVui6UZU0WNp43y1dJxcStIhMvAsf49mkicJ2KKQI-5MO-TQ-ghMExJspgeRIzuIHSBhT016HOjYOyCxzvnM24S_CDsq4gfPBWBL3ZTL2Zv_fZf0-NBzKbSIMJUyIorT2yOaHnwBK0ZKHXlNmVcqAULJg9Ezy9iEnNBp_sABm5jHDCDsTHFccEIuLZxwxsR9VLQON3HtVe1TiaorTL-D9ei48pOCpabcg8Vg4Cd27pwkCKQwZFsaNUTUlmbdENWSaC71Icwkq_kbEq0exg3_qrDntpDaLU4iupiuxYOiHXCkX,Music Software Engineer C#,Cortex IT Recruitment,"London, England",30d+,£95K  (Employer Est.),"Our clients are based in Covent Garden and operate within the music industry. The team consist of around 400 strong and rapidly growing. They are continuing to provide their services to the world's leading media organizations that you must have heard of. 
 The service team will be involved in developing new technology and software for global companies while improving existing systems. 
 They also provide a very relaxing company culture and environment. 
 Your role will be working within a team of passionate and intelligent developers. While developing their core products, you will also be ensuring the system is maintained and improving. You will be using different languages and architectures to assist with keeping the system up to date. 
 A full stack C# role that is primarily working on the backend. Other stacks you will be using include Kubernetes, Docker, PostgreSQL, Linux, Elasticsearch, and Cloud technologies such as AWS. At times you will also have an opportunity to develop new services architecture within this role. 
 This is a flexible remote role with office meet-ups only once a month. If you enjoy working in an office they can also accommodate this to your needs. 
 Skills Needed: 
 Proficiency with C# 
 Experience using Kubernetes and Docker 
 Proven relevant industry experience 
 Ability to solve problems and be analytical 
 Benefit to have knowledge of PostgreSQL, Elasticsearch and AWS 
 Job Owner: a.chan (31397)"
09/08/2022,https://www.glassdoor.co.uk/partner/jobListing.htm?pos=522&ao=1110586&s=58&guid=000001828254d9398beba8f94a9a973f&src=GD_JOB_AD&t=SR&vt=w&cs=1_3a9e5558&cb=1660043975400&jobListingId=1008048418276&cpc=56C4EA4A1A191A49&jrtk=3-0-1ga159mcqgahv801-1ga159md9g4e6800-5039f5878d992bcb--6NYlbfkN0DG4ntHtB_rMsnfhgmnSvK2brktLme1L4SiDeJjQ-izrVOLqRJ5-yjEhSyAj73O13ROpSzp79vSWj4t4eiNXGomrghFTEtA5Sv-q4G8naNLNBtMmadNe24I_sCTAGeZgnCXDBumNB4SLk6tOxDtVtArZyOB6tyld7etFwFcUgGuDz4_wvZTYI94sI8XPuW4oQLN1nhbZFPhdMWPcGPh__n_Qv4Mw0AzdSaf-8rxgmj2H7sjlfShZy1oSY0j2SJjXli_sBtQ03vuLnffT2QbChZW95fqs2YUQjBi-pDQEoRER2Voh6mmShFI51yVMavITy1EpxuSIo6-WZ1nNYMXJSgYKw1CFlYB3lxF7umFyQXnyGTNmCjcKHZIpKBKuacFTOZjcRgtuekVCVp2rd2Sc30qet7Z05UjIkGNUjPuoyo9eyqzVJtyngOsXBhf2K3rb5JPG09cwYHrYZ4WcFiUHdID2iOmY0m4LbNcuUgpBbqVbTw5sfP5SOspi7UQx4DDUChUAi_LPwZFLDAvFot_Twe_LGluz4b1GmOBikC6Gm66K1AS3hyIsStLUeE8taaM7BdYeODxnKQA_uCsVJ9iM93hb-46r2WQUzHzyJ0ep0vfAh7pete1zCP86mKjGxg6sEMbMu9iwOKto2U5kunGykhsDU6LiJViLSSIgfJIp4uRlhKB6PleWamL5GcDV9EVVyfyIJ8xagoKD72TYEI2FgeJg71EDCjHj-ZyDfU8XbUG-SCp9EannreNdo7RaW2Bu_RKXZGyTu6KIC3EO7tAOSEKmiYsWlSokNXFMyVAy-Hm5jlLmThtRK9yG6dPOwESKScpaGO4jK_lfx4iBZEx0kiKunVXXVh0WhTaIz5OKLfmtAxfYy5yg0qtg4MXAC4m2aRgB9NlUsQCw9c0eQXBCek5LPHsmuC2YClhfbjzz5T0u6hNo1skY6a6J_gtdIrwQ51r6s2ZVl8CjvupLtzjZfpz,Full Stack Engineer,Encord,"London, England",6d,£80K - £110K  (Employer Est.),"Encord is a London-based startup building a comprehensive training data solution for computer vision AI applications. We are backed by Y Combinator, the Harvard Management Company, top industry executives, and other leading Bay Area investors. 
Started by ex-computer scientists, physicists, and quants, we felt firsthand how the lack of tools to prepare quality training data was impeding the progress of building practical AI.AI feels to us like what the early days of computing or the internet must have felt like, where the potential of the technology is clear, but the tools and processes surrounding it are terrible. 
We have devised a unique methodology for automating the tasks related to preparing quality training data, in effect turning the training data problem into a data science problem.
 About the role: 
We are looking for an experienced full stack engineer to help us build delightful features fuelling state-of-the-art AI applications. The role will be exposed to a broad tech stack (e.g. ReactJS, Python, REST & GraphQL, OpenCV, PyTorch, GCP, AWS&CUDA, Kubernetes) and the cutting edge of computer vision and deep learning.
 Responsibilities: 
Work with our wider tech stack to own and solve problems from end-to-end 
Collaborate closely with the business teams to understand and solve our customers’ pain points 
Be the clue between dedicated frontend and backend developers to ensure that new features are delivered consistently and that engineering standards are upheld across the many codebases and processes you will encounter
 About you: 
The right candidate will have proven experience working as a full stack software engineer. Experience with any of the following is a plus: 
Stitching together many and large distributed services and processes 
ReactJS (incl. Hooks)&Redux, ES6+, HTML5, TypeScript 
Tornado or Django; Relational database systems (e.g. PostgreSQL); Docker 
About Us: 
https://venturebeat.com/2021/06/15/cord-raises-4-4m-to-automate-computer-vision-annotation-processes 
/https://becominghuman.ai/label-a-dataset-with-a-few-lines-of-code-45c140ff119d 
https://eric-landau.medium.com/introduction-to-micro-models-or-how-i-learned-to-stop-worrying-and-love-overfitting-fd8fbe98e99b 
Macbook 
Flexi-working 
Equity 
Pension 
Team dinners 
Private health insurance 
Office in Soho (London) 
Intro call 
Technical interview I 
 
Technical interview II 
 
Fit interview 
Offer 
React, Redux, TypescriptPython, Django, PostgreSQL, REST, Kubernetes, Redux, HTML5, Typescript, Docker, GraphQL"
