date,url,job_title,company_name,location,old,salary,job_details
09/08/2022,https://www.glassdoor.co.uk/partner/jobListing.htm?pos=404&ao=1110586&s=58&guid=0000018282542941bcbcff68d11483ff&src=GD_JOB_AD&t=SR&vt=w&cs=1_2c72c4e1&cb=1660043930311&jobListingId=1008017279533&cpc=BAEB662971763A76&jrtk=3-0-1ga158accklu7801-1ga158acrg2qu801-cf5dbdc00798b2c0--6NYlbfkN0AXvc7RmZfi56RxHy1Bf3HQh0VbmEEMvhQBgWw2VVoTgdPQVSSIAbC11vy-qy74PefHzqVqoQ4fChGWTUMp7A41t_QZTmeTTf9CcLl8NHiLnP8_xTcPyAqDW2PrsOglLt__b8cvTpA24ov6p5ufQup8gsBCtBQ5f0sLZrEZ5rYZ75Vo5HgfHViRRW6anRlnfFlCiR-FmTyjluBvX286YyloqZwYrp7daLrB0PsPaZq_fBs8VCrSRqp3dq2yK-Jcg9-sJqg2jEF7JhDvQaL7EmDK8zKOr9_1L0r7TWb45jKdmOSLaoXH45m2gN1SLTJIIShrkSKQtLysNqxXLJq7tI_b6XiLgnnvuZCYhEqfnKUGmrua-lNYC7Eqao9Al2Yfs7WW4QJkx0w2StLwsTQRTPo3jQW2uDjj71fHyJVskDTfoP0PapYhQZOYmOv8i4zk0_mgdpvjrP3W21TGw2vOu8TEfbeC3OTvCns4XNVQSDJVf5j4YtFJ-Y3ep3dMH4kaDp_T_K1-S_pb0vI0wo_KJB_1SwPMCSw6P-k%3D,Mobile Developer - Swift - Kotlin Engineer,Get Staffed Online Recruitment,"London, England",19d,£45K - £55K  (Employer Est.),"Mobile Developer - Swift - Kotlin Engineer 
 Remote 
 £45,000 - £55,000 per annum 
Our client is looking for an experienced Mobile Developer to join their remote team. Here’s all you need to know: 
STACK: Swift and Kotlin for their mobile apps. GraphQL between their apps and the backend. Backend is Node.js, TypeScript, and PostgreSQL. They host with Heroku. 
SDKs YOU’LL SWEAR AT: RevenueCat (for subscriptions), MixPanel (for analytics) and Firebase (for user notifications). 
PRODUCT: iOS and Android native mobile apps that allow anyone to instantly add a second work number to any phone. Keep work separate, your personal number private, and share calls and texts with your team. 
THE JOB: Mobile Developer working on our client’s native iOS and Android apps. Competent in Swift, Kotlin, or both. 
REMOTE?: Yes, fully remote working (UK & Europe). If you’d like to work from a local co-working space, they offer a 250 GBP (350 USD) a month allowance. 
FOR YOU: Great salary (45-55k GBP / 55-70k USD depending on your experience level), 25 days off + public holidays, MacBook Pro or BYOD allowance. 
TEAM: Small but mighty experienced, there’s 14 currently (and growing fast!). 
FUTURE GOALS: They see a world with thousands of teams around the world using their app to communicate with customers and each other. On the move, in retail locations, out in the real world. 
FOUNDER: Our client is headed up by John Jackson, who has already built and sold 2 tech businesses. They are funded directly by John’s investments so are in full financial control. 
TECH PRINCIPLES: They have a mature test suite and endeavour to maintain it as part of their development process. All code changes are peer reviewed. They think the best features are a result of tight collaboration between product and engineering. They use the best tools for the job, but they need to be proven. 
DEV PROCESS: Each feature moves through product design, architecture, development, testing, and release, in a Kanban-style workflow that we manage in a tool called Shortcut. 
PRODUCT PRINCIPLES: Focus on user experience, convention over configuration, accessible to everyone, low touch high volume, no jargon. 
MUST HAVES: Commercial experience as Software Engineer (5+ years), Kotlin or Swift (competent, 3+ years), MVVM/MVVM-C (proficient), dependency injection (proficient). 
IDEALLY: GraphQL (proficient), automated testing (proficient). 
HOW THEY HIRE: With respect for your time, and transparency. First some simple technical questions, then a first interview, next a short own-time challenge that takes no more than a few hours, and then a final interview. 
TO SUM UP: Join a financially secure start up, with a grand plan, a small but experienced team, quality tech, sound technical principles, and a well-written codebase. Help millions of small and local businesses to operate, grow, and thrive. 
If this sounds like the perfect opportunity for you, our client can't wait to hear from you! 
Job requirements 
Required: 
Commercial experience as software engineer (5+ years) 
Kotlin or Swift (competent, 3+ years) 
MVVM/MVVM-C (proficient) 
Dependency injection (proficient) 
Desirable: 
GraphQL (proficient) 
Automated testing (proficient) 
INDJOB"
09/08/2022,https://www.glassdoor.co.uk/partner/jobListing.htm?pos=405&ao=1110586&s=58&guid=0000018282542941bcbcff68d11483ff&src=GD_JOB_AD&t=SR&vt=w&ea=1&cs=1_1ff58bde&cb=1660043930311&jobListingId=1007958886971&cpc=26740BCDE5E48596&jrtk=3-0-1ga158accklu7801-1ga158acrg2qu801-f0bb80934b584e12--6NYlbfkN0BKa6OGnKb6i0zi91dcLHmQm64wvvZUGfRhWBBmkHb1JfWVAiUI6Xxxk2dIcWT52XKfgQGmxJadyDS0WQcZtYEIEZUAKegEtgttioGXlQLmWrC7zFsvdddhQJhSesF-ozvvO-6fJ79Pd9BELCX98X55mh8F_ia610HYkVLkQrkMMid3zWUa6sobduAHndxs0M-I5wY-22GnFys5KMLSn7WDj9ESwYlsa3br_bGpS0x1yp5K7eeapAhjSpdsDjR7ZV0lPHVOJXRrdIvIiBiJFZUmbCe4xMDnM3xdNoGY4-WVW6bm5u8XauW1F9BQ1r3oLQb3ig6yFBbf4AqmBHhfvZ11msXg6mfq0Ht62vHIj3ZrArGQOzsjEvidC0opJkNpfLLqGFj2-zyCxu2iRaYsfrDUlbMcqA7lxYumWxOVGHPss-z_AsNYo7b9E_tcpyhx4khJeBmqyaKu4SdLAQXZBD2c__RIMhMwcuGW9-nHhyDyu6M8hMstXGvViuS59IZVx4NsdU09zi8sv0FJlnvN8UG4uD2AQd8NMmJP0qIsSE4-mA%3D%3D,Remote C#.Net Developer - SaaS Tech Company - £55.000,WunderTalent,"London, England",30d+,£35K - £50K  (Employer Est.),"A fast-growing SaaS tech platform company in the Hotel & Travel Space is looking to find a full stack developer to join the team as it enters an exciting phase of growth. A vibrant company with a warm office environment and an engaging forward-thinking company ethos will offer a fantastic place to continue to develop your career. As a C# Backend Developer, you should be comfortable and follow industry best-practices around back-end coding languages, development frameworks and third-party libraries. You should also be a friendly team player, willing to share your knowledge and learning with others. You must be experienced in an Agile approach as our projects are delivered in sprints. Full Stack Developer duties include: Participating in the design and creation of scalable software Writing clean, functional code on the front- and back-end Testing and fixing bugs or other coding issues Responsibilities Work with development teams and product managers to create software solutions Design client-side and server-side architecture Develop and manage well-functioning databases and applications Write effective RESTful APIs  Essential Skills & Experience 3+ years development in .NET, and MVC Strong knowledge of SQL Server (2012+) Development of RESTful APIs Can demonstrate good understanding of current technology stacks Front-end understanding of HTML/CSS and JavaScript, with Angular and Vue.Js experience a bonus. If this sounds like an opportunity of interest get in touch now! Job Types: Full-time, Permanent Salary: £35,000.00-£50,000.00 per year Schedule: 8 hour shift Experience: C# .NET: 3 years (preferred)"
09/08/2022,https://www.glassdoor.co.uk/partner/jobListing.htm?pos=406&ao=1110586&s=58&guid=0000018282542941bcbcff68d11483ff&src=GD_JOB_AD&t=SR&vt=w&cs=1_2c5b867f&cb=1660043930311&jobListingId=1007730938174&cpc=BAEB662971763A76&jrtk=3-0-1ga158accklu7801-1ga158acrg2qu801-64501774f2866785--6NYlbfkN0B4I0z8Vg4C22bXJk453pUE2nnLCUOyY_R-ihB16RDW6wYQUKHhB-cMKfVt-iSg2CvVuO_i2AMDneqvoG7n5_zyjD08dQlupNyRtKr_h4JUhcRvB4igSek3SqQlrEINGMC3-sfRx2LutqbHALaBUwQtKfcGFZrVpapZi40EfItJL73cYKeQ9xTdJ6Ekty5jwFG8zd8x7XlmxdeJ_roiTI2giLgkDIe5emHln7N46z_BC2RtaHk7vAnz1kgkJlPpJaAafyZv5Ru-AAFpk-TADnr-gRtcn75BtJTUIjUPLVOnbLDEVlEWRQumTaHC3asBPsBwDrpMz8o8ie5-c00G3oX_6BJbvQ4hWG15VnlYJj_0mSb-n8NHjldwRsDFyW4Nbe5xoZfUCJWAC4KdypoXhmJpMvFNlyrhZ4CQp2tMlB-noL2uFGCSbFP5EPdUSY4yxrVaSP7jiJbA6C2EZsCU0Q8itXZ3zXzs8IK7JYwD1zj1BZz8cG3lvpb8aloVvDU-QiMwH3pMMrBh9b03YwfY9b4lARmMk6ikMG5OT9PaGIc7hDxOF05cmEed1UCqoN5VM1POxhrOT4_dWpmzPN5CxM29fCmxPwnjR2Say_lYmSfHGz6DSqOYVLv9,Java/Kotlin Developer,Cortex IT Recruitment,"London, England",30d+,£50K  (Employer Est.),"Interested in working for a developer led company? You will be working for a privately owned consultancy, delivering high quality IT systems, meeting challenging business objectives, for investment banks. 
 Looking to expand your commercial Java tech stack? In this role you'll be primarily working with Java and (non-android) Kotlin in a developer led environment. You will be joining a new transformational programme at a leading investment bank, developing a new set of post-trade and risk management systems. You will be using modern technologies to manage external sources of information in order to build a highly available, highly resilient system used by many clients. 
 Requirements 
 You should have proven commercial experience with functional Java in a TDD environment, Lamda expressions, Backend (non-android) Kotlin or any other functional language 
 CloudDevOps experience would be beneficial, using tech such as kubernetes and OpenShift 
 A passion for programming and best development practices 
 Job Owner: c.harris (31103)"
09/08/2022,https://www.glassdoor.co.uk/partner/jobListing.htm?pos=407&ao=1110586&s=58&guid=0000018282542941bcbcff68d11483ff&src=GD_JOB_AD&t=SR&vt=w&cs=1_b0482214&cb=1660043930311&jobListingId=1008048418326&cpc=1160948BCBA38B5B&jrtk=3-0-1ga158accklu7801-1ga158acrg2qu801-2317c33957f593ff--6NYlbfkN0DG4ntHtB_rMsnfhgmnSvK2brktLme1L4SiDeJjQ-izrVOLqRJ5-yjEhSyAj73O13ROpSzp79vSWscbHJz5qEZeleIk-aYuEUd6xTG7yJJJi4XkTgrVmKKtnTyVH_m-tU5UvWZmDihLNBRrbdXaPUQOW_NdsC49yvOFBkqRUWQZEYsfaU32BdAQSiEzwY5kfDXpQIK3yy4YqjsLw4q3HAYrV_Ix6h5SqSFzEUoa9viARkLGBxaWsOTEVDWYU5yKZTBCUVdhaQ-s2IkTOOxXWe19wHLnb__43qzKbzTG3PrBFQYzz9R6PxcB0aJrbHzoNU3YrEMcytGk91r-5WGlM2g6xOrKMsP8S1r0SUbn1z7Hu4WlIEJKCOSAk13HaoQdWceiyY8lgCmo2C99qlBGWElDl6UPalWK5W6j87gVTuoQsEcBHngpSOg6ATqJ7K7ZGI2yFkcvh8P2oj1DhI-B_J6QXTlUh_GTH9X8fveHpdNrIbUbk0Fs4QLa-ycyYYj273lb5vXvWIuRJCXx5_fc-d53iHw9SX5jGfi89p8NEMxv_jFTG_YGop7OJyaxYDeSao8EHM52sFlLSy88SiaND9LrgHYzJWN-cPeS2M9ybnzTuSU4lvzoLfXXqLFcdahnumjGzxM9SkRzpXrrm32iuOH-1VR_SdE3diokTaAN90KE5ERaIbV8f-5BGpx92t93IgVa3e7xfvnTIW4q0DA6JYDOp4a2Y8C5VR8DCSzzfwdbb0sbo_MTwmzfrwTOjzRTxt3JCWfVUyup8hEh-QP0qWYIzxlkVSGqiMxJO986VhIgbTa2PPLK8YHf7S1XaidANMm8FnG_Ud03TZrcx4CMqLgZsBSUhLgEtZEh8GOnWmaCOZ7wRXqMxMLbEZsmras-rZIjOqk68MhCve7WpZVpfQSbh_wye1fStapckWvNlLYMdqGP_ifb5LFqRe5Qa7xeGK23tf7oQa157DIhAIs88RgK,Full Stack Developer,Fnatic,"London, England",6d,,"As part of the Tech team at Fnatic, your days will be filled developing engaging experiences and products across our fast-moving business.
 You’ll have an eye for the fine details and the solutions you develop are the most elegant. You'll get to work on projects from memberships to community features, personalisation across apps and much more! 
You get excited by new techniques, problem solving regardless of the domain, and love the idea of developing highly functional, data-rich complex-systems. Most of all, you're excited to join a small team where your impact is highly measurable and helps amplify a brand loved globally by millions of fans! 
 
Our Stack: 
React, Next.js, Tailwind CSS 
Sanity CMS, Shopify, FusionAuth
 Vercel, Cloudflare & AWS 
Python, Node
 
 Your mission is to: 
Work within an agile team on a range of projects across our Product function 
Contribute technical ideas and workflow improvements to enhance the direction of Fnatic 
Work with complex ecommerce systems and community focused products such as accounts and personalisation within the video game space! 
Launch creative digital campaigns 
Review analytics and performance metrics to draw conclusions and drive change
 
 We're looking for: 
 
Commercial development experience, building and integrating functional components from design spec to production (2-5 years is likely to be suitable) 
A compelling portfolio or deep-dives of previous projects on GitHub etc. 
Proficiency with JavaScript and libraries like React and Next 
Experience working with backend languages 
Experience integrating and building APIs 
Working knowledge of databases both relational and non-relational 
Performance optimisation skills e.g. Workers, Background Tasks, Critical Rendering Path, etc. 
Basic on-page SEO knowledge with supporting semantic HTML, Link structures, etc. 
Working knowledge of headless CMS and/or Shopify is a bonus! 
A quick learner, with an entrepreneurial drive and team-centric mentality 
Excellent verbal and written communication in English 
Desire to get stuck in and explore evolving technologies 
Amazing debugging skills! 
Macbook 
Hybrid distributed/onsite working 
Bonus Scheme 
Private medical insurance 
Fnatic shop discount 
Cycle to Work Scheme 
Eyecare vouchers 
Take What You Need leave policy 
Fruit, drinks and snacks daily 
Recruiter Screen - 30 min 
Role Fit interview - 45 min 
Task - 2/3 days 
Team Fit Interview - 45 min 
Option: CEO Interview 
React, Typescript, Product Design, Node.js, PythonReact, Next, Tailwind CSS, Node.js, Python, AWS"
09/08/2022,https://www.glassdoor.co.uk/partner/jobListing.htm?pos=408&ao=1110586&s=58&guid=0000018282542941bcbcff68d11483ff&src=GD_JOB_AD&t=SR&vt=w&ea=1&cs=1_ea33a95c&cb=1660043930312&jobListingId=1007931253580&cpc=F41FEAB56D215062&jrtk=3-0-1ga158accklu7801-1ga158acrg2qu801-ca07120940c8c530--6NYlbfkN0DgXMGIFt12M9Qsgho7yXKswtEHX54pkhFe0ve4TM42QBZyy2srzgGtKzgdQsUlZa5BQtijPzNOVw05YqWNGu_WB5zLtbiqa_PtzVbM1JJfvYCV9Rk6N76vuGxAsihy79nqkfBFxI6zHy8BwJ_LLFaH4U97_Zdp9FkDQoYYjOt2QUDf-U-K0SuFMhflbon--zApjagnc4hW_EsZS8goiBnG_vCxSwdFIFnH2R-sSjz2bU5DHV4VItBemX7FLWwKbTmMlz-JZIpjZaVBDv8Z2drP1NfC8LyDAlOj64IgEgCk02tLc6vB9U-WDKNezI1EG6Bf3vNRnBWawElv1D0EGDYdVx6naKgF3d1De0P-0F9bMRBISMwiQUU6l45gmRhvieZ_33Er4IgoaWKcTUYn-W7XBPlSUqGVzYMXQTr8lgaTxpxkZtQ-8NhSMWdhFUPa5fhhD_hx8HLvN9gohm2RG3xbb7lVrHMzvYDC4vrsvNC5lNxxjvHzwR2H,Java Developer,Franklin Bates Limited,England,30d+,£40K - £80K  (Employer Est.),"Carve out your career with a company at the forefront of the IP revolution in the media world. Challenge your skills to write robust real-time multi-threaded backend SaaS applications as part of a geographically distributed team. As a leading global manufacturer of broadcasting solutions, this company have an array of international offices with over 1,400 team members who contribute to delivering content in multiple formats to multiple platforms such as on-demand services, WebTV, IPTV and mobile devices across the world. Candidates for the Java Developer role must have the below: Java programming experience at Java 8 or above as a minimum Design patterns Junit and Mockito Multi-threading, concurrent and distributed design BDD A blend of these additional areas of expertise would also be beneficial: Build tools AWS CI/CD TDD Microservices Common API formats You will need to be proactive, a fast learner to immerse yourself into the bespoke systems, not afraid of challenging work, and raring to go! This Java Developer position is offering a salary of £40,000 to £80,000 depending on experience. The role can be 100% remote in the UK (even allowing up to 6 months of working in another country, at their discretion), although you can be based full time or hybrid at the office in the outskirts of Reading If preferred, where there is free parking (including free electric vehicle charging points). Further benefits include: Pension plan Private health and medical plan Life insurance plan Employee assistance programme Discount platform Franklin Bates is a leading IT recruitment consultancy specialising in Software Development, Cloud, & Data. We provide high quality contract, interim and permanent IT professionals to a broad range of technology companies within the UK. Job Type: Full-time Salary: £40,000.00-£80,000.00 per year Benefits: Company pension Flexible schedule Flexitime On-site parking Private dental insurance Private medical insurance Store discounts Wellness programmes Work from home Schedule: Monday to Friday Reference ID: EVE80JD"
09/08/2022,https://www.glassdoor.co.uk/partner/jobListing.htm?pos=409&ao=1136043&s=58&guid=0000018282542941bcbcff68d11483ff&src=GD_JOB_AD&t=SR&vt=w&cs=1_21b96b38&cb=1660043930312&jobListingId=1008044391097&jrtk=3-0-1ga158accklu7801-1ga158acrg2qu801-3d90e99c8ab26310-,Junior Developer (Javascript) - Permanent - London,Explore Group,"London, England",7d,£30K - £40K  (Employer Est.),"Junior Developer (Javascript/React) - Permanent - London
 £30,000-£40,000 + benefits/perks
 
The Explore Group are working with an award winning scale up business taking Europe by storm, on their revolutionary product and business model. They are tech enthusiasts with a great company culture and are looking for 2 junior developers to join their team.
 
 What you will have: 
 
 1+ years Javascript, HTML, CSS experience 
 React / React.js 
 Someone with a ""can do attitude"" and the willingness to learn (don't worry if you don;t know everything - this is for someone who wants to learn new skills) 
 Computer Science degree 
 
You will be mentored by the UK's most creative developers, and join a business which truly values their team and invests in their knowledge and development.
 You will also have the opportunity to work on some of the latest tech, including commercial experience working on frontend, backend frameworks as well as their React Native mobile app!
 
You will have career progression to move up to mid level / senior engineer positions in the near future
 
For more information, please apply to this advert or alternatively email Iqbal on iqbal.miah@exploreltd.com
 
React / React Native / Node / Javascript / Typescript / HTML / CSS / Testing / Web app / Modile app / developer / junior / University / Computer science /"
09/08/2022,https://www.glassdoor.co.uk/partner/jobListing.htm?pos=410&ao=1136043&s=58&guid=0000018282542941bcbcff68d11483ff&src=GD_JOB_AD&t=SR&vt=w&ea=1&cs=1_c08b64bc&cb=1660043930312&jobListingId=1006451058099&jrtk=3-0-1ga158accklu7801-1ga158acrg2qu801-0f148dc157b0b1b6-,VueJS Front End Developer,Emtec Ltd,"London, England",30d+,£50K  (Employer Est.),"Do you want to work for one of the fastest growing e-commerce brands in the UK? They are about to go global and have already expanded into a number of countries outside the UK.
 
 With a turnover of over £20,000,000 these guys are already taking the market by storm and are rapidly becoming one of the most successful e-commerce companies in their particular sector.
 
 They are now looking to hire an additional VueJS Front end Developer as they look to scale and ensure their technical product develops at the same pace as their growth.
 
 You will be working on a customer focused e-commerce front end based subscription product where the user experience is at the heart of the system using VueJS, HTML, CSS (LESS/SASS)
 
 More generally (primarily on the backend) they are redeveloping / redesigning a monolithic product into a more microservices based system and ensuring their technical offering is future-proofed and de-risked.
 
 Coding in VueJS and CSS the Front end Developer will be joining an existing engineering team of 6 working alongside other backend PHP engineers and their other front end developers (VueJS). You will work closely with their senior devs and Software Engineering Manager / Scrum Master as well a their CTO who remains close to the code.
 
 The company have won numerous awards for their product and have a collaborative and creative culture who welcome growth and learning in all their employees whilst putting the customer experience at the heart of everything they do.
 
 they are now really looking to scale and also diversify their product offering so this is a chance to join a ""non-risky"" startup who have a tried, tested and established product before they really explode.
 
 Key Skills:
 VueJS
 
 HTML / Javascript / CSS
 
 LESS / SASS
 
 API Development
 
 Prototype Framework experience (Bootstrap, Foundation etc)
 
 Nice to Have:
 Expereince developing SaaS solutions
 
 AWS
 
 Ecommerce Experience
 
 CMS Experience
 
 Location:  South West London 
Salary:  Up to £50,000 
Benefits:  All the usual (pension etc) plus some you wouldn't have expected! 
If this VueJS Front End Developer role sounds of interest please submit your CV via the link and we will be in touch to arrange a call
 
 Benefits:
 
 Work from home opportunities
 Flexible working hours"
09/08/2022,https://www.glassdoor.co.uk/partner/jobListing.htm?pos=411&ao=1136043&s=58&guid=0000018282542941bcbcff68d11483ff&src=GD_JOB_AD&t=SR&vt=w&cs=1_64e594de&cb=1660043930312&jobListingId=1007149762950&jrtk=3-0-1ga158accklu7801-1ga158acrg2qu801-3b02588ee73e43da-,JavaScript Developer,BGC Partners,"London, England",30d+,£74K - £107K  (Glassdoor Est.),"JavaScript Developer 
 A driven software development professional is required to join the BGC Trading Systems development team. The role involves mainly front-end development work but there is an opportunity to work on Node backend services and middleware libraries. Knowledge of UI frameworks is required but more important is the ability and the desire to write clean, concise and accurate code, and to deliver solutions for complex problems, sometimes under pressure from tight deadlines.
 Why BGC 
 BGC is a dynamic, fast-paced organization that supports the inter-dealer broker markets across numerous brands in a competitive marketplace. Technology is viewed as an enabler and often, new technology choices are trialled & adopted to find the right solutions to our business needs. Candidates will find they have direct influence over technology choices progressing the firm forward with its objectives to service all-tier banking needs. The working environment is friendly, social and collaborative. 
 
 Key Responsibilities: 
 Maintenance and support of existing front-end web trading applications 
 Development of new trading screens 
 Development of Node JavaScript services and maintenance of platform libraries 
 Essential Experience: 
 Proven working knowledge of modern JavaScript development practices. 
 Understanding of basic data structures and design patterns. 
 Expertise in at least one modern JavaScript UI framework, preferably React + Redux or Vue.js 
 Experience with HTML5, CSS and Web design. 
 Experience with build and package management tools such as NPM, Gulp, Webpack.
 Some experience of a statically typed language e.g. Java, C# or C++ 
 3+ years of experience of Frontend Developement 
 
 Desirable Skills: 
 C++ development experience 
 Node.js + experience, developing REST APIs 
 Knowledge of Backbone, Jquery and Polymer 
 Experience with Chrome debugger tools. 
 Dev-Ops tooling (Git/TeamCity/Ansible/Docker) 
 Agile methodologies/practices
 Real-time trading system development experience 
 
 Personal Attributes: 
 A problem solver, an independent thinker 
 A good communicator, able to describe complex problems concisely in written English 
 Accuracy, an attention to detail 
 Practical, looks at technology as a tool to achieve the goal rather than the goal itself
 An interest in financial markets and trading
 An understanding of UI design principles, an interest in a polished UI
 An ability and a willingness to learn new skills quickly 
 
 Qualifications/Education: 
 Education to degree level is preferred"
