date,url,job_title,company_name,location,old,salary,job_details
09/08/2022,https://www.glassdoor.co.uk/partner/jobListing.htm?pos=101&ao=1110586&s=58&guid=000001828251b5ee95801ad3e8dc76f4&src=GD_JOB_AD&t=SR&vt=w&ea=1&cs=1_87f92768&cb=1660043769697&jobListingId=1008005277161&cpc=22715C420ED4C941&jrtk=3-0-1ga153dh1g2da801-1ga153dhjg4e6800-7c728510a92fe3d2--6NYlbfkN0CxNmOqnGDVYSSyPCDxG8qhJ8j5RD3itsp7LH07lhJ3RvRGWethC_9wYMN8zLf9EcFwP-Ut0CNixhPifIEcHayAyZEhTzviGlT1_tC8z4I5-G5flMvS_8jtlJdk60T2nAo1DbU0F0pAJN1qCAqlYAfFYVaxD1m_BTtgToQQRTZObYe-g4bBiwy3vRUyir3iPrh8hUW6NhnBsv6wcNco80H_OKWm-48UA_APfYOlpVenCCn-HxKDPwi1Uc10hN-lO1Z8KPS3BmwzQ0m_4P8X0xpPyy8uftMxExt5XR9NfcjFr7N_0JOBzHN41h8glLNhlMvdeLbrzjgYogINPUdwOlFlt2ZJARvO_lQ5rkJ5WC1216v5GWkeZ1pmAfJDMNdTWM5X1_4Fnroms1gYJmJUO_Cjko2Q8n8r9evwWL12-df2TEHOv_JROJetOLcbaFyRHOZbJ72eIeQ9TAfQ1vnsF8bRT2y1dBaM8u_B78MUFG9lEIptmcydvKt1a35mGt2_6v8cFsd8_OuShw%3D%3D,Senior Backend Developer,XPLORA TECHNOLOGIES LIMITED,"London, England",25d,£60K - £75K  (Employer Est.),"We are Xplora, a fast-growing wearable technology business. Xplora was founded in 2016 with a vision to connect families and encourage exploration without compromising security or fun. The success of our first award-winning wearable technology has led to the launch of a broader portfolio of connected products, further enhanced by our collaboration with Sony Interactive Entertainment to get kids playing outdoors. Via a single platform, XPLORA allows people to connect everything they love and its critically-acclaimed products are trusted by over 500,000 families worldwide. XPLORA has offices in Norway, UK, Germany, and Spain, and we have big plans to continue expanding in Europe and North America Main roles and responsibilities. · Work with development teams and product managers to ideate software solutions · Design server-side architecture · Develop necessary APIs for the front-end of applications through appealing visual design · Develop and manage well-functioning databases and applications · Troubleshoot, debug and upgrade software · Create security and data protection settings · Build features and applications with a mobile responsive design · Write technical documentation · Work with data scientists and analysts to improve software Core Skills/Experience · Good knowledge about building a web application in JS framework, NodeJS, and Rest API · Familiarity with databases (e.g. MySQL, MongoDB), web servers (e.g. Apache) · Experience in AWS Services i.e., EC2, VPC, S3, RDS, Site to Site VPN connections, Transit Gateway, AWS Lambda, IAM, AWS Secret Manager. · Familiarity and operational knowledge of open-source systems. · Experience building and maintaining a CI/CD pipeline in Jenkins and AWS developer tools like code commit, code build, code deploy and code pipeline. · Excellent communication and teamwork skills · An analytical mind · Preferable experience in the service under Amazon Web Service · Enjoys working in a fast-paced and collaborative international environment · Over 5 years of proven development track record prefered Job Type: Full-time Salary: £60,000.00-£75,000.00 per year Additional pay: Bonus scheme Schedule: Monday to Friday Ability to commute/relocate: London, W4 4PH: reliably commute or plan to relocate before starting work (preferred) Application deadline: 31/07/2022"
09/08/2022,https://www.glassdoor.co.uk/partner/jobListing.htm?pos=102&ao=1110586&s=58&guid=000001828251b5ee95801ad3e8dc76f4&src=GD_JOB_AD&t=SR&vt=w&ea=1&cs=1_1ce9f5cc&cb=1660043769697&jobListingId=1007754351284&cpc=3999BE48C643E528&jrtk=3-0-1ga153dh1g2da801-1ga153dhjg4e6800-768fd4bc8733a5e6--6NYlbfkN0C90w7urWg8DKuJiaw03xotkREnl9h6MiASZ2ckhFRC2MHybpML7BgwZWZ_LzWo2pR1EgUPSMaUN3l_QwpvOWksDeMgZ2lOSyDRyF_drb_80ANKfwaowHdLsszNuxz-5ZaLK3IA8Sqr3AAZPS2joOA6IAqP2hUXYtPC3uBF6shJ5GnQNGTTCs2_LeKHZzBTk2by51apXtKXFWxORZRZX_zS3o4GrApQt-lRpDxKdHhHMei5QtJTu8hTpU_puWx9beXIaum9glDxw7634Z45oqAMi_qJnwQIyZt1tf6081UaT4JclPCiE_fwbuBgbLsK3uki6exAJ9-2qrk-uQgUmo-ocDueYaihkq0qST8msVtododmH3JC-qBhODKCeSAjGQo-vS3RxjCnAsNlHmpnNT5h7Cf0c_Or5rRgGTYPVDWL6pcMZzNNE--AUVN6lMHle44Y2G7Iyelqolf89k7c-3uaxsiqVxCFZ-R9A8LfrIPJgMfTqMO9mgpQZ_wXUFZ6S1XnQCK6CkY6Wg%3D%3D,Backend Developer - VIDA,Visual Data Media Services Limited,"London, England",30d+,£64K - £75K  (Glassdoor Est.),"About Us Visual Data put some of the world’s favourite TV shows and films in front of audiences - in every continent and on every screen. We deliver thousands of hours of premium content to platforms and broadcasters on behalf of international distributors and content owners. We combine fantastic people and the latest technology to ensure we get it right every time. Responsibilities:  Develop high-quality software using Node.js, Angular, Typescript Utilise implemented RESTful APIs Implement new product features and user interfaces Design front-end solutions based on mockups and direct cooperation with UX designers Actively participate in code reviews Contribute to all phases of the development lifecycle Drive engineering-wide initiatives, interacting with different teams and stakeholders Requirements:  Experience with the development of applications with microservices and/or serverless architectures using Node.js Experience with the Cloud technologies (AWS) Working knowledge of Git, REST, Docker, microservices High focus on the quality of code and delivery excellence Experience with an agile methodology Candidate must be extremely organised and able to work under pressure Proactive, positive & confident approach Works well in a team and also on their own Fun outgoing personality and good people person Experience in the film or TV industry an advantage Keen to build your skills in a dynamic and industry leading company Stack:  NodeJS 12 Angular 12 MySQL AWS What we offer:  Fast career path and the possibility of further development in many areas Work in well-coordinated international team Projects for global clients Remote work Paid holidays B2B contract only Job Types: Full-time, Permanent Benefits: Work from home Schedule: 8 hour shift Experience: .NET: 1 year (preferred)"
09/08/2022,https://www.glassdoor.co.uk/partner/jobListing.htm?pos=103&ao=1110586&s=58&guid=000001828251b5ee95801ad3e8dc76f4&src=GD_JOB_AD&t=SR&vt=w&ea=1&cs=1_d3060fba&cb=1660043769697&jobListingId=1008049587259&cpc=DC9BC4DEE5BC1459&jrtk=3-0-1ga153dh1g2da801-1ga153dhjg4e6800-0a5ba8135ffc1adc--6NYlbfkN0DHJo2ARW3l5b3rOEJLbTCwkJR9E7SrSznxvSheMislSAA6qvvh8raTzdwp5agvBzXAp21ArReNVVy6RRgJPOkn5UhFfwXsMS2B6fiHyE13F3w3eCrj9e-_wNfjfjiSpX3a-1UpRjdubmP-DDIaHmF6JYVSGZDfKY29gItDq0Dpx7mN25WrW9BJ7xW2wVl0CGzu8PHSjOBeQBZafMLymVrN3ulCi0C8z8sFa7aM0XqAy_Hb7CdZNL7sHkhW1uwlFRGmRy55SfkyrzPEpX8xJyIDmx-HiQrneuu1if0N0Xmq8wuPHq1YpbQT6wLzh7RqCLWOZcR2RU2m1PO5wPoYY8UoQjmwEncEtRDgJMnXgfEYi36isLfwb1-XFJYMNeruxtFEiao2zV7tKpe-DT0SU-G2vGFlnyWztbjd4HE3YzRHXToZ_Xx2sG-kUFys1xNrMIs8PDWiIkYvuzWeRXm9HCReGiGRpkLNmE-jwTWGK_88pUsDOW5IfwopCZKxkYoha2KmDRgtcXLgPA%3D%3D,Typescript Node Developer,Succeed Solutions Ltd,"London, England",6d,£60K - £65K  (Employer Est.),"You will be part of an amazing team of developers, building next level platforms that allow the ships to order the goods and parts they need to continue running without a hitch. You will be crafting performant backend modules, processing large scale data sets, exposing both REST and GraphQL APIs, dealing with Event Streams via Kafka or EventHub and a lot more. What skills do you need? Amazing person and team player 2+ years of proven commercial experience Strong experience working with Javascript/Typescript Strong experience developing API endpoints and GraphQL servers (Apollo preferably) Experience using NoSQL and SQL databases Amazing to have:  Experience using message queues and event streams (Kafka, EventHubs) Previous experience working on a large scale enterprise application Experience using ElasticSearch Ability to deal with large datasets (millions) Performance first mindset Job Type: Full-time Salary: £60,000.00-£65,000.00 per year Benefits: Work from home Schedule: 8 hour shift Monday to Friday Ability to commute/relocate: London, Greater London: reliably commute or plan to relocate before starting work (preferred) Education: Bachelor's (preferred) Expected start date: 29/08/2022"
09/08/2022,https://www.glassdoor.co.uk/partner/jobListing.htm?pos=104&ao=1110586&s=58&guid=000001828251b5ee95801ad3e8dc76f4&src=GD_JOB_AD&t=SR&vt=w&ea=1&cs=1_df1eeeb2&cb=1660043769697&jobListingId=1008040246662&cpc=728EA7D4449150ED&jrtk=3-0-1ga153dh1g2da801-1ga153dhjg4e6800-6be2e61acb6c4899--6NYlbfkN0A5DQ7y-TQd9l0NZB_e0Eb17-SevXSvoOBb_lVST3ieP2bIocBappHmZnBGLWEKg2BgssYfrxfMF7NrtfErx0YPw41NwmNZYdcSF4D6O9J5BcujzCUFlHOq03cdimweImNS6gtTv52KeGvNyFdJkDHv3Yw0iqtCpd5av5pkIZFSDiNWbNAeTZAkjh_tDuRVk4G8P9hqy4eMfro6T05Eb-7voCzCZ509VSc_eHak5_SGqFcjj_3Ja4e4OA6EqmTpGnK0kWqcw6zGjjFL5khZbgkgH4juCBVHmr__GTXRjuYZ3R-lr_fNsNFV9G1G5S2ipj12hGYgvCSpIYrCrFolRe6EyCdjygbQgE6B8wXGV-xdgnte6R97X3hgGCfdZ6F5aA3XHWa5slp-HOk7NIu57hXJn1_6yeqk_wkJktFSf_Owef_uTOxhU4ZV53RXPPy1VGePnXqTpkBGuQYnTml-6XoTV1q8yplHlTBAxY4TVlls0iuVmbHa0L8cxnzFLyVZzpj5eVzQiWYQI6eHEnbzCX3d9ngRXB0xvimfZujZYoZMWQ%3D%3D,Senior Full Stack Developer for New Events Platform,Mas & Pas Limited,"London, England",8d,,"A new online events platform is seeking an experienced web developer to join a small London-based team. Our mission is to grow and develop a web-based family events platform and ticketing service. Required Experience:  5+ years’ experience in web development in particular PHP and JavaScript Comfortable with custom-coding a variety of web applications Knowledge and experience of all stages of web development from ideation to deployment Good communication skills Fluent level of English language is necessary Good Use Of:  Backend: PHP, MySQL, MVC, JavaScript Frontend: Vue or React, JavaScript, HTML, CSS, JQuery Database: MySQL Other: GIT Optional: experience with Docker, GCP, AWS, Python, React Native, Scrum (or other agile methodologies), TDD/BDD would be a bonus Key Responsibilities:  Ensuring the smooth running of the events platform Optimizing for fast page-loading speeds and no service interruptions Planning and architecting the development of a number of new features Delivering projects to agreed deadlines Delivering projects in good quality and after thorough testing Problem-solving any issues with the site, including diagnosing and correcting any bugs Able to work either alone or in a small team Able to communicate effectively with the other team members, both those with and without technical knowledge You would be working in a small team of web developers and a designer. The right candidate should be based in/around London, UK and able to commute to North London for office-based work two days a week. About Our Company We develop projects for two digital platforms geared towards parents. One is a custom-built events platform for finding local events, and the other is an online parenting community and editorial website with over a million annual visitors. To Apply Complete our Google questionnaire and we will review your details: https://forms.gle/XrdnKtn1Qn7qP5Ap8 Job Type: Full-time Additional pay: Bonus scheme Schedule: Monday to Friday Ability to commute/relocate: London, N6 4EJ: reliably commute or plan to relocate before starting work (required) Education: Bachelor's (preferred) Experience: PHP: 5 years (required) JavaScript: 5 years (required) Language: English (required)"
09/08/2022,https://www.glassdoor.co.uk/partner/jobListing.htm?pos=105&ao=1110586&s=58&guid=000001828251b5ee95801ad3e8dc76f4&src=GD_JOB_AD&t=SR&vt=w&ea=1&cs=1_eff92ed2&cb=1660043769698&jobListingId=1008049946940&cpc=E8EA07442FE90C22&jrtk=3-0-1ga153dh1g2da801-1ga153dhjg4e6800-6c34864940ea7ceb--6NYlbfkN0BEsySMRvkCRgbuhILf1Lab2kPQKcH_PvBTa2L9j87KxHvuelSvq2VL6uljSGnZme8btmI8L_MjRf2fduBJrIFrBKyw25NH0T3PQkk_p9SIuVf6pVKQdftMlYwchpcb_WHvsScLcwLwo_YiopbQdPAuAPRfn-WckM-mgnEb7KK5AMmL1Ur42_Zf_Gft_68YAMMhdoZBIvoZIg73OcksG7pxl_9cEFqSKCCaPnlB8JRsMnDhTDt8l1lMW3axsGfeMPckR45Yny5GmIEE-8Y_2NZMl0kYKaxEPuKZ51GoaS7p6OIiadLCYejf8UmlU5pp71XukfZMjso0U8PIH2NEEOnSShrVHrcmOPwPClR-v3sTnFR5enTAeib572h8R-DrD1eP93W1cF6vHg12d2DvkCsGVSzPuqMHUfmqPJR6MqXxuGzx54hG8NmHY8qRcLWtKZ2eBhWGrawEr5xnb9kWmu3RwykR_xQ-reiiF_TUhAPUkTPqP4kjDE56f3E7Jl5l_2JoZAIrPJ7uttvbbrUmPFpMnyMZLewnGt0stJiSU3yA9A%3D%3D,Senior React Native Mobile Developer Web3 (Remote),Aldrin,"London, England",5d,£50K - £130K  (Employer Est.),"About Aldrin Labs There is a steep learning curve when it comes to crypto. Only once overcome will we have mass adoption. Aldrin Labs aims to debunk the belief that decentralized finance is inherently complex and separate from centralized finance. We will amend the frustratingly poor user experience and fragmentation that millions of crypto natives and newcomers face. We will seamlessly merge the centralized and decentralized world. Aldrin Labs aims to be purposeful. We strive to halve the fifty working years of the average person. This is the mission of Aldrin Labs. Aldrin Labs has Aldrin DEX and is incubating an innovative mobile app, a crypto wallet and also working on a money market. These protocols will integrate with each other to provide easy functionality and purposefully help people achieve financial freedom. We are a fully remote company. We are interested in capturing the best talent, no matter where you live. The Role We are looking for a Senior React Native Mobile Developer with extensive experience in designing, building, and deploying highly secure, scalable, and maintainable client-facing UI systems. You will be one of the senior developers of the mobile app working closely with our designers, product owners, and backend engineers to develop and maintain high-quality mobile applications for a global audience in an extremely fast-growing industry. We work with a modern tech-stack. We use Typescript, hooks, eslint, reanimated, automated CI and deployments, etc. We work with a design system and an updated figma design. If you are extremely passionate about mobile platforms and translating code into user-friendly apps, we would like to meet you. Ultimately, you should be able to help design and build the next generation of our mobile applications that will impact and shape the financial lives of a growing audience. You will: Contribute code to our iOS & Android React Native apps from the get-go Work on integrating and collaborating with other crypto products to enrich the user experience Implement features with the aim to provide long term stability of a highly scalable application Developing clean and reusable react native components Actively contributing new ideas and innovative UX/UI patterns Play an active role in evolving our mobile engineering practices Minimum Qualifications: Strong expertise in React Native with 3-5+ years of professional experience building high-quality mobile apps High-level experience with TypeScript Have experience with best-in-class client-side data design and management, whether that’s experience with GraphQL/ Apollo or other such tools Have a passion for good design and attention to detail. You’ll collaborate with designers but undoubtedly have the opportunity to express your own design sense if desired Verbal fluency in English Nice-to-Have Qualifications: Demonstrable portfolio of released applications on the App Store or the Android Passionate about crypto markets, blockchain technology, and decentralized applications Knowledge/experience working on mobile financial applications/cryptocurrencies/wallets Experience with Solana Web3 frameworks and technologies, especially on mobile Experience working with a large codebase and detox or appium testing tools Experience with responsive UI and debugging skills Experience developing high-performance mobile app interfaces Bachelors or Masters degree, preferably in Computer Science, Computer Engineering or other technical (STEM) field or an equivalent of experience Benefits: Competitive salary Remote work in a dynamic, fast-growth Web3 startup Flexible working hours Opportunity to work with a diverse, global, and passionate team Collaboration with leading projects and thought leaders in the crypto space At Aldrin Labs, we celebrate a truly diverse and inclusive company culture and are committed to equal employment opportunity regardless of race, color, ancestry, religion, sex, national origin, sexual orientation, age, citizenship, marital status, disability, or gender identity. Job Type: Full-time Salary: £50,000.00-£130,000.00 per year Benefits: Flexitime Work from home Schedule: Monday to Friday"
09/08/2022,https://www.glassdoor.co.uk/partner/jobListing.htm?pos=106&ao=1110586&s=58&guid=000001828251b5ee95801ad3e8dc76f4&src=GD_JOB_AD&t=SR&vt=w&ea=1&cs=1_2b1158ad&cb=1660043769698&jobListingId=1008062079895&cpc=7F925F5888094D6A&jrtk=3-0-1ga153dh1g2da801-1ga153dhjg4e6800-8cfdba8b430523a5--6NYlbfkN0D4z3Ek1WlbyWAOqlQyAv63edCpIsls2edeeJq8MyeNTTKB96mOsxpKUk884alhAoao_BVKi3jeTdidP7V5MFGa6UNhkWnqbTaZlWNrBP7ODi6qZ1M0PPz4rEiWI8cfo7RCvZo0vWmyL5TN_0D-ikJiyszGUDG2cKNQf7lHk-0XHsOJDSb2K-8jr7V6ycEjfN86Vfw0D5V9JD4PMel303SEczXczwFui65R1TP-8-KZY59oSv1sUn9cL68WxOwAexF8TaAUSqOnpnWTH9_oSgA4VjZZHsOOuRGvx_UgYG8Z66hC83sA0-QZLo0PP4_-EUgvx8q-g6awVfuGUoF3L5X84dP2ig2fw4S8zWxsJ8jeUF3en7R83li-q5IPtzn0aJ9cdQC5Gn7iAmeA90cDoV0DAyQf90dm7DX35IrXSBh_lv9PiEFCstL2iWQDZBWfV6w1WAerfSRJ2R5lZ1A1VmTmfb6PfAfLpXFj_zf_s4GG2uJKULbBTnsd07X3DCleQAFNoHoBrQsRHw%3D%3D,"Senior Backend Developer (Engine, Networking, Plugins & Integrations)",Marshmallow Laser Feast,"London, England",24h,£45K - £55K  (Employer Est.),"Marshmallow Laser Feast (MLF) are looking for someone to join our team as our  Senior Backend Developer (Engine, Networking & Plugins)  and help craft the next wave of high-profile artistic endeavours. You will work as a senior part of the technical development team under company senior management where you will help build the core systems and tools that feed our real-time workflows. The ideal candidate will have strong experience and knowledge of system programming, network architecture and library development in core languages such as C++, C# (.Net) & Python. We are especially interested in candidates with real-time game engine knowledge including a history of shipped titles, experiences or artistic endeavours. As our Senior Backend Engineer, you will manage, maintain and iterate on the in-house infrastructure, libraries and plugins that make our whole team more efficient and our experiences more seamless. Working at the cutting edge of technology means that sometimes the solution doesn't exist, being a key part of our close-knit team of technicians, artists and creators knowing when to build bespoke, or use off-shelf solutions is a vital part of the role. With over 4+ years of hands-on experience in the field, you are as capable of leading as you are developing, able to guide, mentor and suggest solutions to others and directly line manage our existing Junior Backend Developer. You will join a team of 12, directly managing 1. This position is full-time, with an initial fixed contract of no less than 12 months, where we will seek to make permanent arrangements. MLF supports flexible working arrangements and a designated home base. However, this role will require you to work from our London studio 60% of the time (3 days per week), growing with project needs. Where applicable, skilled worker sponsorship will be offered. This role may require up to 2 months of non-consecutive international travel each year - projects depending. Responsibilities Working as a senior part of the technical team to develop, produce and create the core systems that drive our experiences, from networking protocol structure, and bespoke plugin integration through to novel systems Understand and implement the pipelines for complex external systems within modern game engines (Unity & UE specifically) Ability to recommend and evaluate custom implementations vs off-the-shelf solutions to best solve problems Guide and mentor junior developers and peers in best practices Maintain existing codebases and provide low-level support on complex programming problems Management of internal codebases and libraries Learn, develop and progress into new engines and tools as they emerge Best practice version control and Dev Ops Requirements 4+ years of experience, an extraordinary github/professional portfolio or a history of shipped titles/experiences Extensive knowledge of C++, C# & Python with proficiency in others Software development: system architecture, modular systems, version control, collaborative development, API design Computer Science: networking, image/depth/transform data, algebra, matrix manipulation, 3D maths Physical Engineering: understand the real world implications of embedded systems and user experiences Expert understanding of networking and working with data (formats/storage/compression/transfer) Specific needs: API development, SQL database management, knowledge or willingness to learn ZMQ networking paradigm, Classic REST/GET/HTTP design, JSON data structures, Protobuf experience, C#/python wrapping experience DevOps: CI/CD, Jenkins, Docker, Gitflow & build pipelines Would Be Nice Experience with Game Engine content production pipelines Understanding of modern Web3, Blockchain and DAO Understanding of emerging technologies and their applications Some understanding of shader development/integration Understanding of physical computing VR / AR / XR technology and methodology understanding Comfortable working in small group environments to accomplish larger tasks Details This role is full time Holiday at 25 days per year (plus bank holidays all pro rata) Flexible working options and childcare-friendly practices Initial 12-month contract, with a 3-month probationary period Pension contributions ~£50,000 - depending on experience About Us Marshmallow Laser Feast is an experiential design studio based in Hackney Wick, London. We are a small team of around 20 which grows on a project-by-project basis. Our expertise has earned us a reputation for creating the seemingly impossible—for producing installations that push boundaries, redefine expectations and excite audiences worldwide. Our work is responsive and spans kinetic sculpture, film, live performance and virtual reality. Web: Marshmallowlaserfeast.com IG: marshmallowlaserfeast Apply We believe that proven skill and attitude are the most important factors in our team. If the above does not match your profile but you feel this role and MLF in your bones, please apply. This is a full-time position lasting 12 months, the role will be open until we find the right person. We will seek to extend this at the conclusion of the initial contract. MLF is a multi-national and multi-cultural team. We currently employ and support employees from all over the world under a number of visa schemes. As with all our positions, this role is eligible for sponsorship. MLF is working on becoming more diverse and inclusive every day: we are not perfect and recognise that there is still work to be done, and are ready to do it. We encourage candidates from all backgrounds to apply. Please send your CV and a unique cover letter, explaining how you fit the role and what you would bring to Marshmallow Laser Feast Job Types: Full-time, Fixed term contract Contract length: 12 months Salary: £45,000.00-£55,000.00 per year Benefits: Additional leave Company pension Cycle to work scheme Flexitime Relocation assistance Work from home Schedule: Monday to Friday Application question(s): What do you know about Marshmallow Laser Feast? Why are you interested in a role at Marshmallow Laser Feast? Describe your C++ engineering experience. Do you have hands-on development experience with VR/AR/XR devices? Describe your knowledge and experience with networking protocols (Eg UDP/TCP/REST/ZMQ), and where you have applied them. Reference ID: Senior Backend Developer - Aug22"
