date,url,job_title,company_name,location,old,salary,job_details
09/08/2022,https://www.glassdoor.co.uk/partner/jobListing.htm?pos=220&ao=1110586&s=58&guid=00000182825286ac8e27d25f3faa914e&src=GD_JOB_AD&t=SR&vt=w&ea=1&cs=1_344fa795&cb=1660043823166&jobListingId=1008043388493&cpc=155EB9D5185558AF&jrtk=3-0-1ga1551mt2p8n001-1ga1551nfg4cq800-c924e4fb588b9cec--6NYlbfkN0DIaXaR7dTpX_A-Rxdwo6yaKo884Q0MY7CIaUoFp9FEmcJvfrwjlz9JDlre0AmwlD7L2IaGZszR913QM3849S1vowyOi8UoyiEzn-1mh-sdnEMs5fKdpbpwosjiTQafFwxflUd4p8zhySW1KiTgEui4vp2-EzZ2J3o9VdfujaxcHI63YzS6yE8P9EjsrfYuNWo3YhbpBR_v3DbyCaiQDqXLsnQT-03gftjNnYq3N-LavtMBbvAvjXzy1MjRExhixjdigkUC0Zg69Fc_2BLdUHapELqLKo-mMiSjhdQnb4_npiUVdOlpsjR-CTKT4_Asf3mmMMMbkdWgWlYhsB72uTw_HWedWAUFnh6LTxX78R2q9qTIPNzSh9foJumeVjMXGYmalEhkXedjzfipp8RMDNoy2FLlkiPs5scs1Gcnxm2jlbuzV__85W3bKGLerB7pJEjNIFl-tvP8xi40asR-ctPW1SmXvVJo9KWwDtmTLsjg5BzJdKzhUtfYsA6zpvsfMVEfsGxVrPcWuEOx9MCpBzv7AxHy-JEC-OgXjW8cFTS17o47U_rxUV3zKaeHNG3dTgPdsRT0ckWgaa3YTjILT8P5,Backend Developer C# .Net Core AWS,client server,"London, England",8d,£90K - £120K  (Employer Est.),"Backend Developer / Software Engineer (C# .Net Core AWS Kubernetes IaC) *Hybrid WfH*. Are you a data centric backend technologist seeking complex and interesting systems to apply your skills; continually learning and progressing your career? 
You could be joining a technology driven Hedge Fund that invests in sports betting markets. 
As a Backend Developer you'll join a multi-disciplinary business aligned product team responsible for high-value critical trading applications. You'll be building systems to manage large datasets which can process updates in real-time with high throughput and low latency; these systems are released with high frequency with technology choices that are continuously evolving. 
You'll be an integral part of a talented Agile development team with exposure across the full technology stack but with a focus on backend C# .Net Core systems; you'll be working in Sprints and Pairing with colleagues who are passionate about code quality within a collaborative environment. 
Following a remote interview process you'll join the team in North London twice a month for meet-ups but can work from most of the time (more office time if desired). 
Requirements: 
Strong C# serverside experience including multi-threading and .Net Core 
Good knowledge of Kubernetes, AWS, IaC, Terraform 
Good understanding of Event Streams and Event Sourcing (EventStore, Kafka, NoSQL) 
Familiar with Front End JavaScript frameworks (they're using React and Angular 6+) 
Good knowledge of high availability technologies and concepts 
Familiar with deployment automation and build environments 
Excellent communication skills 
Degree educated, Computer Science or similar 
As a Backend Developer / Software Engineer you will earn a highly competitive salary (to £120k) plus significant bonus and benefits. 
Apply now or call to find out more about this Backend Developer / Software Engineer (C# .Net Core Kubernetes) opportunity."
09/08/2022,https://www.glassdoor.co.uk/partner/jobListing.htm?pos=221&ao=1110586&s=58&guid=00000182825286ac8e27d25f3faa914e&src=GD_JOB_AD&t=SR&vt=w&ea=1&cs=1_11d39d56&cb=1660043823166&jobListingId=1008050012178&cpc=7F6F94E2229B3AB5&jrtk=3-0-1ga1551mt2p8n001-1ga1551nfg4cq800-64e3d62815b63b62--6NYlbfkN0DIaXaR7dTpX_A-Rxdwo6yaKo884Q0MY7CIaUoFp9FEmcJvfrwjlz9JDlre0AmwlD5CQXiMdkt_KpSVAS6-ucf9cXNsB8-TLTw32NYGklxr62_oNEQAJh16wzoebFOeHRKC7RQbfkB8gSBGAskiGp-xVHceYvWXlTIWz8EhZ3xZilchL439fTJDUvgM4dmZmUOny--mMdDEMJOVC-flz4cq3tl5rUaqNZVb-OH-cUAtOSZTVJ8Dmz5KTNHsYmOQ8VBkywyKkKHQdRuyQ5ziuOGzWtEavsnCHo3KPV1EJccRPEpFPQbOdTQu6rLReqlu9dWG1QjCXsUq-yzvmYSdYPXhQIBo3I5cZl1wC-BC1Nj35-UEnVuFm3MxqxVXRR0flEKT95b0_8PNTdMD6EgBoUyLEzrGehxpbcZuLnI3uyRND0rDW17I1U2OPNhsna4l1bT9WbuSRnbayUvJ87GcGuItby5Cpp-vh-h5BTvetPoDNiWFrC-w9e3mXtOyPflj-UYfvWxwyx_2IGkDJgoYMU907t1utSelBZSO2PmoLSCp7Np8vJ-Vndz-aYx6VrddUvFhCEU5EGgs2vZpE_CTHf_ZnqhztW53krE%3D,Backend Software Engineer - Python Data Algorithm,client server,"London, England",5d,£110K - £140K  (Employer Est.),"Backend Software Engineer / Python Developer (Data Algorithm Quant Maths) *Hybrid WFH*. Are you a data centric Backend Software Engineer with strong Python coding skills? You could be progressing your career at a tech driven trading firm, working on complex and challenging ultra-low latency trading systems and seeing the results of your efforts quickly whilst earning significant bonuses.
 
 
As a Backend Software Engineer you'll implement tools for performing statistical analysis and algorithmic trading and build a library of techniques and processes for use in later research or trading strategy design. You'll collaborate with Researchers and Product Managers to provide guidance on architecture and set the coding standards, helping to create scalable and modular solutions to standardise implementation and use of common methods and functionality.
 
 
You'll join accomplished colleagues, problem solving collaboratively within a technology driven environment where you can work with a great deal of autonomy.
 
 
There is currently a remote interview and onboarding process as well as the ability to work from home until September, following social distancing you'll be expected in the office 2-3 days a week with the rest of the time working remotely.
 
 
Requirements:
 
 You have expertise with Python programming
 You have fluency in programming fundamentals and mathematical techniques
 You're able to communicate with non-technical stakeholders and present information clearly and concisely
 Ideally you will have experience of working with large data sets; time series data; Python libraries such as SciPy, NumPy, PyTorch, Pandas, Pickle, HD5, Feather; financial markets knowledge would also be a benefit
 You're likely to be degree educated in Computer Science, Maths or similar STEM discipline
 
As a Backend Software Engineer you will earn a competitive salary (to £140k) plus significant bonus and benefits package.
 
 
Apply now or call to find out more about this Backend Software Engineer / Python Developer opportunity."
09/08/2022,https://www.glassdoor.co.uk/partner/jobListing.htm?pos=222&ao=1110586&s=58&guid=00000182825286ac8e27d25f3faa914e&src=GD_JOB_AD&t=SR&vt=w&cs=1_d111d069&cb=1660043823166&jobListingId=1008061777834&cpc=48B9F4758953335C&jrtk=3-0-1ga1551mt2p8n001-1ga1551nfg4cq800-cb79f404ba378e11--6NYlbfkN0DG4ntHtB_rMsnfhgmnSvK2brktLme1L4SiDeJjQ-izrVOLqRJ5-yjEhSyAj73O13SUufTapnOrVNnbda7Krt6LtIv2sb3-CTSDZb5wLywGholwbiBa7i44pdgw8wcgwe2q-aygw4_sc-dI36oyXL6L9lWmRld2BWQFuKmPxvlKFRZKkraiekZOWaIy2YNIP5NPwccSQCIPnY-d6pGQ4Xrzc4v8UzgXNFUE65dBDZYXvtnbIe51fgFTC_bsSb6CIa7lgwnUuJ6tMlJ1s-aUyuOmrbDFuRgvcGYmZ5MzUvRAp61XWh-JmYRhd6katZ0OFj8vgnfm_UPW3oX3ZJ5MhAphzgtIZF8iw9a1ClZtaKRA2yplQ-bfkbSGuTZE0ya0RkE4hwaD6I6eTTmrNBHwm3WeIRwbCWNZvnXOImpQGcv-CvzqjeCGQnldPRWuSjCJgAXCLKGrTFHz0pSNKH7yjcECJHjLpWc2DxLDoyMB1Xw01U3LclDaxPI0yzAWs-34VpDCRIwFpS_FemNodm-IkPPskyq890a_e_4Tz3rRjVhOH4-oIA_foUwN7M-Ghd4I-lmHpDo_wWV2F8OE3y_nPkpCFfRCr1hnb6iUq7mHGy_zJRIue66kLUYMrxNyQFcSP7hn616WPmMLvzGjiG-l255r5F_-BmVOiJcSiIyj5_cpMBrGdXpi_lAWTVoxcGpN3VVMz1r7ZdhQerSlrAiM1tz_gcNdC6xaRXoI3W8jyuCdPfebGPaPps1JNnFVYxPOt60jlmIAiwDTbtGT3jlQxG4xLzm6q2TrNAONrWMTVLxCR8Wzqd26mYnLKd1w2LwkF8pQciaJuy90_XC2U5jxQ8Rcmr7jDDVDikaZUwmgsbrGPDkOSnFbHucy8QevTkMwrKuyBBymalLLA0qoPi7asdKEbdxd3jJt7ElMmPXGnjr9H6X_SSzgUtHisvvU3mTOM0dLhDQL34h1PTvS5uc0dN3zszjCmR-DNN4%3D,React Developer,Celer Technologies,"London, England",24h,,"Celer Technologies is a global financial software company that has created a modular-based platform with the flexibility to meet today's dynamic business environment. As a company we have many years of experience in the financial services technology sector, working with clients who are often frustrated with their rigid systems. With this in mind we were determined to create a software package that would meet our clients' constantly evolving business needs. 
Simplicity, speed, reliability, integration and adaptability are the key criteria for an optimal software system. Global offices in London, Hong Kong and Toronto ensuring full time-zone coverage for all disciplines. We provide clients with an extensive training programme enabling their development teams to build onto the Celer platform in the future. Whether your requirements are simple or more extensive, our modular-based system allows you to tailor the Celer platform to fit perfectly within your business.
 About the role: 
As a frontend engineer you will be working on a number of exciting react projects. This includes a greenfield project, which is currently underway, to build a futures and FX trading application. We also have a number of other react applications, including a react-native mobile app. All of our projects use redux for state management. 
Our projects are hosted on gitlab and a CI/CD approach is utilised for deployment, along with the gitflow model for structuring our development. The backend systems are written in java with a microservices architecture, which communicates with the frontend using grpc-web or JSON. It is vital the candidate has at least one year of react and redux experience. Any experience with material-ui and styled components would be beneficial.
 Requirements: 
React 
Redux
 Nice to have: 
React-native 
gRPC/gRPC-web 
Java 
Websockets 
Typescript 
Finance/fx experience 
Bonus scheme 
Remote working 
Pension 
Video call 
Technical test 
Final call 
React, ReduxReact, Redux, React Native, Java, Typescript"
09/08/2022,https://www.glassdoor.co.uk/partner/jobListing.htm?pos=223&ao=1110586&s=58&guid=00000182825286ac8e27d25f3faa914e&src=GD_JOB_AD&t=SR&vt=w&cs=1_73c915db&cb=1660043823166&jobListingId=1008054420224&cpc=1160948BCBA38B5B&jrtk=3-0-1ga1551mt2p8n001-1ga1551nfg4cq800-e229acfae2dbcf0c--6NYlbfkN0DG4ntHtB_rMsnfhgmnSvK2brktLme1L4SiDeJjQ-izrVOLqRJ5-yjEhSyAj73O13TCxVdkS1CXGaWSWFwpHQmtM2CBNGxW-u8Vx_V7gcgzACfrFBBaF6akTFH2jRDkZAFOkfZSPkXt0gaKukJw_vGD6l8-Cg5T3EtO5YF7CzEU1pKM-72XiROHCl7d2DEn6r49Oh2b85j_0ForQaLCfdoqBeydbNo4k2SC9EgsVh7j9LBR-8fDdJL4VT_GEx809_ynR8djoJHFq-5Is8n9NKhBZB_BUBiNPc8rT_9ay0pTRpKFaZlIF01AbGXIP71dl22TaP7xrG61wFXDJZo4D3DfChCPH2G1lqqC5ZUmQWCWDo3pp5D_VWyAGPc0pUl9SwqWHB9jX_d4RG2X1zeYndlWN-hiLVjMg-Vk5KKe6gkilyQfDHS5goPmsAH-OtQF-VwgrPVMrPI9NVi4niDmi5DPlglvQPLt2SdSiixzVErDrN4aeLRYBvbVUpdqIg9p3FkwYBGqp_6BzJ3mIhDgiDdVnR_oTxYd4Qb85xtziAW6W3iOuJHTDEYvc1feHrxtWpa5xVvbehviBnZFSzoL-_BqqgszIbOwufSKVtQ6xHtYRzaKL4Ps1HxmFXZwS7M9m8hkcHAQlrCrbT6_8I0rh6glLiqKKljUSHoNuoQEnGdtJNSgvEcohHUuNTjwdBJ01h5DaA_3wUZMTpu4l_I_YIijojNOiec8dc09Ygrn_y63SB_rJzUfz4Ib3Sy7tYPCa8z-fT_s50S5rvtzA10N35SPlfHma4XBrdEZCTd8p01i02T9UH2P8Q9OTMedk0bijRQmCTXrkNsGLK8WfJ7SqG2eerN0AnoQCZ56n4cp-U-GyokNs6fcdo1SJ0j9RW0_Q5ySTw4h0bR1zIcYbwDGvxmrHe16GSB5e_6_5lDJ0JUByQacnarCpmTj5dMSvhqS9401NnmxBXjTfbxl9dqmsaAHxbt7z9QCwLOB9DbBbWCOHSjvCe9NsaT1,Frontend Developer (React Native),Sorted Food,"London, England",4d,£60K - £80K  (Employer Est.),"As a Frontend Developer at Sorted you'll predominantly be working on the development our flagship Sidekick app. Sidekick is a mobile first application developed with React Native and written in Typescript. You'll continue to help us build out the product offering to bring real value to our users lives. You'll work in a small tight-knit cross-functional team, iterating quickly with other developers. 
We're all about getting working software in front of users and iterating fast based on feedback. We're also focused on introducing game changing concepts which continue to build on our USPs. 
You’re someone who makes things happen, takes a lead and encourages others, despite ambiguity and changing requirements. You can calmly handle periods of breakneck scaling and moments of chaos. You have a passion for innovation and solving real customer problems, not just shipping code. 
 
Responsibilities: 
You'll be part of a team taking product, design and data inputs to make decisions, create new features and iterate quickly based on direct customer feedback 
You'll be working closely with top-tier frontend web, mobile app and backend developers, building out new in-app functionality 
Tooling and CI improvements - we're always striving to automate as much of our e2e process as possible 
Helping product designers and product managers by providing critical and valuable feedback throughout the product discovery process 
You will help shape our development processes and company culture
 
 Requirements: 
We don’t expect anyone to know all the answers. We learn from one another, adapt fast and share ideas. We’re looking for people who can move fast and are comfortable working in a changing environment whilst being highly autonomous. 
3 to 5 years of relevant work experience as a frontend developer 
Proficient with React Native (preferred) or React and common implementation patterns & APIs - e.g. Redux, Animations 
A good understanding of Typescript and component level testing approaches 
An incredibly high bar for velocity of shipping and the quality of your work 
A strong desire to learn from others and to always be improving 
Impactful experience in a scaling startup environment and/or at a major tech brand (not required but would be ideal!) 
Competitive Salary 
Workplace Pension 
Annual company bonus scheme 
Quarterly team offsites and social activities 
Free membership to our Sidekick app & free Sorted Food cookbooks 
Flexible working set-up with a hybrid of remote and office-based work 
There is a kitchen in the office - tasting recipes is encouraged!
 Screening Phone Call 
Technical Tests (Take-Home/Remote) 
Final Stage Interviews 
React Native, ReactReact Native, React"
09/08/2022,https://www.glassdoor.co.uk/partner/jobListing.htm?pos=224&ao=1110586&s=58&guid=00000182825286ac8e27d25f3faa914e&src=GD_JOB_AD&t=SR&vt=w&cs=1_44da32f6&cb=1660043823166&jobListingId=1008053314882&cpc=48B9F4758953335C&jrtk=3-0-1ga1551mt2p8n001-1ga1551nfg4cq800-19a1c035d1359629--6NYlbfkN0DG4ntHtB_rMsnfhgmnSvK2brktLme1L4SiDeJjQ-izrVOLqRJ5-yjEhSyAj73O13TyPNUT-TZJ0p8FVeNdQGUjkCH_Z4xJPao63pnOL0eF_X4weMdZKrLUcaoV_odGWJExpbbMgOi5m8y-PGfARnTHbW6IdBg5vRtJqhUzqp-tabMybV7p5u33-LcUmuNkikhj_ak_usmLxct5sJ4SnLH5RMzxqR4KAiJ15LaCEQRuMgU_8-v35ItYPEut1qQlQM94qufkFqkIXSIqbAssDLRRuFdfuEAyDufKi3Yow0edScfwNFz6rA9D0r9kHXgXMKCoQo0-Ku9_ylcNNZX7oEaXNUptGfft22VKHFr28kTbMk9o7RSZvIRbG2XWeSho5Mv4oYxbGstLKAO3G9CIhNpmI0s-T6aB1vPdE9a4Qe8R_xB4s_TYx8kzgl_iO2TyYFia_8I6HqXUe58lYU_PcXLLJ8qMmDRVebK06rEFGFx2DiMWB-2LZj60RqBOR0c5xV9XOwm2qHYe0DHTRDphZ85Sr1AOibTPFaHpLd2H4sQpiwrs2DLOq5rBXiUVv40mpndSbzpk7Unnb_VeWR9tjWVdGJjAJK8RMgxciZn9q-rdLebek58zeDhLSGau1nm5UOzEUvSajCSkyRnxrWt5E2LHX7ERbomOHilGisivVgcTzH1n2EkMoeEnYFuP3k1lFK0tXOcjxJQ-GajJfGIlO0aZH50vNFtnY2T8wrrAGMmWtzba1CzCUUlqLA7Uu_1xqR0hAtkHWE2JkCXd8Azxl_Tsq_5zdCUuUKc3ZI7dyIzlfOtkOfLwcOz3hhk2tUua2xQe2uzCk8can8dJeUnnzG856ZfvP2N20Bs13kW9IRA_eTxjKk5ExdUaze3noIeLJo1FZqmOKfMYr7j8TLy9fVrfh1Sk60zlIHNn00UjRZY9se_9HodCEZXPlzKDqn1pC5mg8ag4tgQBQKm6s4uCORzaWs3MpV2FFiQ%3D,Backend Software Engineer,Red Sift,"London, England",4d,,"At Red Sift, we are delivering the industry’s only integrated cloud email security and brand protection platform. As a result, we are helping to make the world a safer place, enabling organizations across all sectors, including many of the biggest brands, top law firms, financial services providers, technology innovators and government agencies defend against business email compromise (BEC) attacks, while streamlining how we protect against ransomware and phishing attacks. 
Internally, we encourage an open, collaborative, customer-centric working environment. We are one of the fastest growing companies in our industry and we’re currently looking for talented, creative problem-solvers to help us build a safer future for everyone.  About the role: 
We’re looking for outstanding Backend software engineers who understand that good code exists to support products and the user experience, and that good code is code that gets the job done in a simple and maintainable way. Fundamental to this role is working closely with our product team and cybersecurity analysts designing and building out scalable and performant code that serves to protect our customers. 
If you’re looking for a role that gives you the opportunity to take on a wide range of responsibilities, with a high degree of autonomy and significant room for growth, then we want to talk to you!  About you: 
We generally don’t have hard and fast requirements - everyone is different. Core attributes and skills we are hoping to see highlighted in your application are: 
Have built your career writing clean, well-tested and maintainable code, and can apply this knowledge to a new platform environment like our Red Sift platform. 
Is very proficient with Node.js (knowledge of Golang would be a plus) 
Passionate about product and delivering exceptional user experience. 
Have experience working with React front-end. You don’t need to be a React developer, but you should be able to navigate the code and understand its main principles. 
Experience working in a company in a stage of major growth. 
Understand fundamental computing principles such as data structures and algorithms. 
Understand and apply the principles of software craftsmanship - designing things as simply as possible, but no simpler. 
Clean and tested code. 
Pragmatic approach to problem solving. 
Open source activity and contributions. 
Experience in working on consumer facing B2B products. 
Foodie. Our error identifiers look like this - ‘strain_thin_tortellini’, ‘glaze_copious_currants’, ‘sprinkle_full_oregano’. It makes for a better user experience than random hex identifiers. 
Macbook 
Flexi-working 
Remote work 
Equity 
Bonus scheme 
Pension 
Cycle to work scheme 
More Happi 
ClassPass 
Introduction Video Call 
15min Tech Test 
OnCall Technical Task 
Video Call with Team Leads 
Node.jsNode.js, Go, React"
09/08/2022,https://www.glassdoor.co.uk/partner/jobListing.htm?pos=225&ao=1110586&s=58&guid=00000182825286ac8e27d25f3faa914e&src=GD_JOB_AD&t=SR&vt=w&ea=1&cs=1_900ff160&cb=1660043823167&jobListingId=1008027969381&cpc=E773D000C9BC26FA&jrtk=3-0-1ga1551mt2p8n001-1ga1551nfg4cq800-c383a88ca2ff7526--6NYlbfkN0BKa6OGnKb6i0zi91dcLHmQm64wvvZUGfRhWBBmkHb1JfWVAiUI6Xxxk2dIcWT52XKoKe0upbuMWjnjguAmFhBjbF29eI-L0GWkEbYppI8t37BiCFsMrOCTvBy15GDmiCodvoVIy07zA1Fa7bqNN9wAEC3VTHtdU66U7FZeKLSpqGeFL9F7PiGh7y6_UvKIeZToLWk-WwxLwwHsPVHc-VfNCCflxvL0G7RVWYv49BHuItDyYKrgz4K6EstQZOKFmwBo0G_PSFWBo-V2nQL4LtcIrGVRkXbNFPKLlVOvRhxm6unKczSA2S1FURHTLuxnm5klVM-bN6I--Awc9Iv-ukjsjFeEdG6C_nrPo25VDBN8q-CPabTyoVKW7sOj7iwDiHfDGER2owgMsTSYMH6ceU0khmnltc0EBD5endgzHAfk1upZ0D9efZIIwOmVXs_IlLRai6WFTNKQzWMC2w5lOiK1qRgX5omqfyYKcP4TSq3aI_FS0bnSwGCtrXemC8cr7x_IzGljWeYgOc3gqqVG_tR2WFLika9Tp2GjgJQ5L_Suz7zcAaGlE7rM,Full Stack Developer - ID Verification SaaS Platform - Up to £70K,WunderTalent,"London, England",14d,£60K - £70K  (Employer Est.),"Our client is an award-winning ID Verification and Anti-Money Laundering (AML) SaaS provider that empowers companies to verify a clients' identity through AI. They are looking to grow their team to accelerate the growth through performance and process scaling on their flagship product. They are looking for someone who isn't scared to take ownership of projects to join them and help with their rapid growth plans. What they are looking for:  3+ years experience with backend development in Node/TypeScript and experience in frontend development using Angular. Experience of building micro services using Node and AWS. Experience and knowledge of design patterns, data structure and algorithms. Experience of GIT and writing Unit Tests. Experience of developing large scale systems with AWS. Highly motivated and ambitious outlook Attention to detail and security. Positive attitude, self driven able to work alone and as part of a team. Nice to have:  Exposure to Docker. They offer a competitive salary package and a platform for ambitious developers to take their next step in their career - fast-tracking careers significantly for outstanding individuals! If the above apply to you and you believe that you would be a great fit to the team, don't hesitate to apply and we will have a quick discussion about the role. (and others you would be suited for!) Apply now Fullstack Developer Job Type: Permanent Salary: £60,000.00-£70,000.00 per year Schedule: 8 hour shift"
09/08/2022,https://www.glassdoor.co.uk/partner/jobListing.htm?pos=226&ao=1110586&s=58&guid=00000182825286ac8e27d25f3faa914e&src=GD_JOB_AD&t=SR&vt=w&ea=1&cs=1_f688a55e&cb=1660043823167&jobListingId=1008030556243&cpc=1160948BCBA38B5B&jrtk=3-0-1ga1551mt2p8n001-1ga1551nfg4cq800-eb6dbd2a8e0b0423--6NYlbfkN0DgXMGIFt12M9Qsgho7yXKswtEHX54pkhFe0ve4TM42QBZyy2srzgGtKzgdQsUlZa6hDQbSl22lOET-y-_EbwlE8eobl27MxCyYpHGeKDU8b9rLzfmR5BRCMtgLi6RJPrrDEXc0YEIHifPNOlkLsrlKqBE0i01piZw7wBn1udLeD8N2XQaKN8wXgw3Dis1dCuLOGQTFPEIbGpHMWKQvIbX7RzUGUG5cyuX3j3VF1EpI9nuW-7zV8TS3ZMJcE_JL_BblMtp3WWcFzuX1Hvw0jt2C0T_EoPKURp_U0wGOwBEecqODWpLProfd0-Zux5p7TZxwf8YiaLeXR030PcY4ilHSopItXVAUMe45e3YeZxBhoeiKYMlDLf8dJHhiXHmT_h9Icny0R3fi_8rBpUiTnWoALBQJgTvQepBU9gqIQQTCUgxyt401TflzCVaHjTAosuNIWt4jddnYkUYQxCRj1llzqpq1EGns437awChqGcIk-VskZjzHUdvD98yc41Ry1BG3keaHKmqVAOY--kjER81R,Java Backend Software Engineer,Franklin Bates Limited,"London, England",13d,£50K - £70K  (Employer Est.),"Would you like to work for one of the world’s leading software providers? This is a fantastic opportunity to join a cutting-edge software company in the Fintech/Asset Management space. They are one of the world’s leading software providers for secured, business-to-business lending, used by banks and financial institutions across the world. You will be joining the Software Engineering team, comprising of 80 people, which is their biggest function! The team play a key role in ensuring that the company continue to be leaders in their field. This is a Java focused, Backend Software Engineer role, with strong elements of Spring and SQL, and you will be maintaining and developing new features in user interfaces. Your duties as a Java Software Engineer will include:  Write clear, concise, understandable, and documented code. Make sure all code is fully tested. Take responsibility for estimating, planning, and managing your own work. Understand the technical composition of the products. Requirements of the Java Software Engineer:  Proven hands-on software development experience. Experience in Java and the Spring framework. Relational Database knowledge and SQL experience. Nice to haves for Java Software Engineer candidates:  Previous exposure to microservices. Knowledgeable with key libraries, like Junit and Jackson. You can work mostly remotely with just a weekly visit to their state-of-the-art offices in Central London, and a base salary of up to £70,000 is on offer with a great range of benefits including:  Annual bonus opportunity Family friendly policy Flexi time policy Private medical cover Health cash plan - money back for everyday healthcare needs Travel insurance Life insurance Corporate gym membership Volunteering scheme Java / Spring / SQL / Microservices / Junit / Jackson / Software Developer / Software Engineer / Hybrid Working / London / Fintech / Asset Management Franklin Bates is a leading IT recruitment consultancy specialising in Software Development, Cloud, & Data. We provide high quality contract, interim and permanent IT professionals to a broad range of technology companies within the UK. Job Types: Full-time, Permanent Salary: £50,000.00-£70,000.00 per year Additional pay: Bonus scheme Benefits: Company pension Flexitime Gym membership Life insurance Private dental insurance Private medical insurance Work from home Schedule: Monday to Friday Reference ID: LS70JBESE"
